[I 2025-08-12 15:47:21,312] Trial 464 finished with value: 1.063508540391922 and parameters: {'conv_layers': 3, 'conv_activation': 'sigmoid', 'conv_kernel_size': 5, 'conv_batchnorm': False, 'adaptive_pool_size': 3, 'lin_layers': 3, 'lin_activation': 'relu', 'lin_batchnorm': False, 'lr': 0.005}. Best is trial 275 with value: 0.21435055881738663.
[I 2025-08-12 15:47:21,995] Trial 465 pruned. 
[I 2025-08-12 15:47:23,672] Trial 466 pruned. 
[I 2025-08-12 15:47:24,088] Trial 467 pruned. 
[I 2025-08-12 15:47:26,360] Trial 468 finished with value: 1.051998496055603 and parameters: {'conv_layers': 3, 'conv_activation': 'sigmoid', 'conv_kernel_size': 5, 'conv_batchnorm': False, 'adaptive_pool_size': 3, 'lin_layers': 3, 'lin_activation': 'relu', 'lin_batchnorm': False, 'lr': 0.05}. Best is trial 275 with value: 0.21435055881738663.
[I 2025-08-12 15:47:28,508] Trial 469 pruned. 
[I 2025-08-12 15:47:30,679] Trial 470 finished with value: 1.0778412520885468 and parameters: {'conv_layers': 3, 'conv_activation': 'sigmoid', 'conv_kernel_size': 5, 'conv_batchnorm': False, 'adaptive_pool_size': 3, 'lin_layers': 3, 'lin_activation': 'relu', 'lin_batchnorm': False, 'lr': 0.001}. Best is trial 275 with value: 0.21435055881738663.
[I 2025-08-12 15:47:33,479] Trial 471 finished with value: 0.8415759801864624 and parameters: {'conv_layers': 3, 'conv_activation': 'sigmoid', 'conv_kernel_size': 5, 'conv_batchnorm': False, 'adaptive_pool_size': 2, 'lin_layers': 3, 'lin_activation': 'relu', 'lin_batchnorm': False, 'lr': 0.001}. Best is trial 275 with value: 0.21435055881738663.
[I 2025-08-12 15:47:36,091] Trial 472 finished with value: 1.0386099815368652 and parameters: {'conv_layers': 3, 'conv_activation': 'sigmoid', 'conv_kernel_size': 5, 'conv_batchnorm': False, 'adaptive_pool_size': 3, 'lin_layers': 3, 'lin_activation': 'relu', 'lin_batchnorm': False, 'lr': 0.001}. Best is trial 275 with value: 0.21435055881738663.
[I 2025-08-12 15:47:39,062] Trial 473 finished with value: 0.7044310867786407 and parameters: {'conv_layers': 3, 'conv_activation': 'sigmoid', 'conv_kernel_size': 5, 'conv_batchnorm': False, 'adaptive_pool_size': 1, 'lin_layers': 3, 'lin_activation': 'relu', 'lin_batchnorm': False, 'lr': 0.001}. Best is trial 275 with value: 0.21435055881738663.
[I 2025-08-12 15:47:40,656] Trial 474 pruned. 
[I 2025-08-12 15:47:42,600] Trial 475 pruned. 
[I 2025-08-12 15:47:44,248] Trial 476 pruned. 
[I 2025-08-12 15:47:45,404] Trial 477 pruned. 
[I 2025-08-12 15:47:48,375] Trial 478 finished with value: 1.057180643081665 and parameters: {'conv_layers': 5, 'conv_activation': 'sigmoid', 'conv_kernel_size': 5, 'conv_batchnorm': False, 'adaptive_pool_size': 1, 'lin_layers': 3, 'lin_activation': 'relu', 'lin_batchnorm': False, 'lr': 0.001}. Best is trial 275 with value: 0.21435055881738663.
[I 2025-08-12 15:47:50,384] Trial 479 finished with value: 1.0599815249443054 and parameters: {'conv_layers': 3, 'conv_activation': 'sigmoid', 'conv_kernel_size': 3, 'conv_batchnorm': False, 'adaptive_pool_size': 1, 'lin_layers': 3, 'lin_activation': 'sigmoid', 'lin_batchnorm': False, 'lr': 0.001}. Best is trial 275 with value: 0.21435055881738663.
[I 2025-08-12 15:47:53,236] Trial 480 finished with value: 0.9342173635959625 and parameters: {'conv_layers': 3, 'conv_activation': 'sigmoid', 'conv_kernel_size': 5, 'conv_batchnorm': False, 'adaptive_pool_size': 1, 'lin_layers': 3, 'lin_activation': 'relu', 'lin_batchnorm': False, 'lr': 0.001}. Best is trial 275 with value: 0.21435055881738663.
[I 2025-08-12 15:47:54,022] Trial 481 pruned. 
[I 2025-08-12 15:47:55,172] Trial 482 pruned. 
[I 2025-08-12 15:47:57,448] Trial 483 finished with value: 1.0746397972106934 and parameters: {'conv_layers': 3, 'conv_activation': 'sigmoid', 'conv_kernel_size': 5, 'conv_batchnorm': False, 'adaptive_pool_size': 3, 'lin_layers': 3, 'lin_activation': 'relu', 'lin_batchnorm': False, 'lr': 0.001}. Best is trial 275 with value: 0.21435055881738663.
[I 2025-08-12 15:47:59,179] Trial 484 pruned. 
[I 2025-08-12 15:48:00,477] Trial 485 pruned. 
[I 2025-08-12 15:48:02,909] Trial 486 finished with value: 1.0624642372131348 and parameters: {'conv_layers': 3, 'conv_activation': 'sigmoid', 'conv_kernel_size': 5, 'conv_batchnorm': False, 'adaptive_pool_size': 3, 'lin_layers': 3, 'lin_activation': 'relu', 'lin_batchnorm': False, 'lr': 0.001}. Best is trial 275 with value: 0.21435055881738663.
[I 2025-08-12 15:48:05,463] Trial 487 finished with value: 0.6194835007190704 and parameters: {'conv_layers': 3, 'conv_activation': 'sigmoid', 'conv_kernel_size': 5, 'conv_batchnorm': False, 'adaptive_pool_size': 3, 'lin_layers': 3, 'lin_activation': 'relu', 'lin_batchnorm': False, 'lr': 0.001}. Best is trial 275 with value: 0.21435055881738663.
[I 2025-08-12 15:48:08,081] Trial 488 finished with value: 1.07080078125 and parameters: {'conv_layers': 3, 'conv_activation': 'sigmoid', 'conv_kernel_size': 5, 'conv_batchnorm': False, 'adaptive_pool_size': 3, 'lin_layers': 3, 'lin_activation': 'relu', 'lin_batchnorm': False, 'lr': 0.005}. Best is trial 275 with value: 0.21435055881738663.
[I 2025-08-12 15:48:10,477] Trial 489 finished with value: 1.0890116691589355 and parameters: {'conv_layers': 3, 'conv_activation': 'sigmoid', 'conv_kernel_size': 3, 'conv_batchnorm': False, 'adaptive_pool_size': 3, 'lin_layers': 3, 'lin_activation': 'relu', 'lin_batchnorm': False, 'lr': 0.001}. Best is trial 275 with value: 0.21435055881738663.
[I 2025-08-12 15:48:12,017] Trial 490 pruned. 
[I 2025-08-12 15:48:14,855] Trial 491 finished with value: 1.0425519049167633 and parameters: {'conv_layers': 3, 'conv_activation': 'sigmoid', 'conv_kernel_size': 5, 'conv_batchnorm': False, 'adaptive_pool_size': 3, 'lin_layers': 3, 'lin_activation': 'relu', 'lin_batchnorm': False, 'lr': 0.05}. Best is trial 275 with value: 0.21435055881738663.
[I 2025-08-12 15:48:17,371] Trial 492 finished with value: 1.0600678324699402 and parameters: {'conv_layers': 3, 'conv_activation': 'sigmoid', 'conv_kernel_size': 5, 'conv_batchnorm': False, 'adaptive_pool_size': 3, 'lin_layers': 3, 'lin_activation': 'relu', 'lin_batchnorm': False, 'lr': 0.001}. Best is trial 275 with value: 0.21435055881738663.
[I 2025-08-12 15:48:18,556] Trial 493 pruned. 
[I 2025-08-12 15:48:20,723] Trial 494 finished with value: 0.9817230701446533 and parameters: {'conv_layers': 3, 'conv_activation': 'sigmoid', 'conv_kernel_size': 5, 'conv_batchnorm': False, 'adaptive_pool_size': 3, 'lin_layers': 3, 'lin_activation': 'relu', 'lin_batchnorm': False, 'lr': 0.001}. Best is trial 275 with value: 0.21435055881738663.
[I 2025-08-12 15:48:21,272] Trial 495 pruned. 
[I 2025-08-12 15:48:24,217] Trial 496 finished with value: 1.065120816230774 and parameters: {'conv_layers': 3, 'conv_activation': 'sigmoid', 'conv_kernel_size': 5, 'conv_batchnorm': False, 'adaptive_pool_size': 3, 'lin_layers': 3, 'lin_activation': 'relu', 'lin_batchnorm': False, 'lr': 0.001}. Best is trial 275 with value: 0.21435055881738663.
[I 2025-08-12 15:48:26,635] Trial 497 finished with value: 1.0889021754264832 and parameters: {'conv_layers': 3, 'conv_activation': 'sigmoid', 'conv_kernel_size': 5, 'conv_batchnorm': False, 'adaptive_pool_size': 2, 'lin_layers': 3, 'lin_activation': 'relu', 'lin_batchnorm': False, 'lr': 0.001}. Best is trial 275 with value: 0.21435055881738663.
[I 2025-08-12 15:48:28,764] Trial 498 pruned. 
[I 2025-08-12 15:48:29,649] Trial 499 pruned. 
