[I 2025-08-12 15:36:21,405] Trial 136 finished with value: 0.9255454540252686 and parameters: {'conv_layers': 2, 'conv_activation': 'sigmoid', 'conv_kernel_size': 7, 'conv_batchnorm': False, 'adaptive_pool_size': 4, 'lin_layers': 1, 'lin_activation': 'relu', 'lin_batchnorm': False, 'lr': 0.0001}. Best is trial 0 with value: 0.2918410822749138.
[I 2025-08-12 15:36:23,789] Trial 137 finished with value: 0.9119811356067657 and parameters: {'conv_layers': 2, 'conv_activation': 'sigmoid', 'conv_kernel_size': 7, 'conv_batchnorm': False, 'adaptive_pool_size': 4, 'lin_layers': 1, 'lin_activation': 'relu', 'lin_batchnorm': False, 'lr': 0.0001}. Best is trial 0 with value: 0.2918410822749138.
[I 2025-08-12 15:36:25,470] Trial 138 pruned. 
[I 2025-08-12 15:36:26,939] Trial 139 pruned. 
[I 2025-08-12 15:36:29,284] Trial 140 finished with value: 1.0619003772735596 and parameters: {'conv_layers': 2, 'conv_activation': 'sigmoid', 'conv_kernel_size': 7, 'conv_batchnorm': False, 'adaptive_pool_size': 4, 'lin_layers': 3, 'lin_activation': 'relu', 'lin_batchnorm': False, 'lr': 0.0001}. Best is trial 0 with value: 0.2918410822749138.
[I 2025-08-12 15:36:31,863] Trial 141 finished with value: 0.9867069721221924 and parameters: {'conv_layers': 2, 'conv_activation': 'sigmoid', 'conv_kernel_size': 7, 'conv_batchnorm': False, 'adaptive_pool_size': 4, 'lin_layers': 1, 'lin_activation': 'relu', 'lin_batchnorm': False, 'lr': 0.0001}. Best is trial 0 with value: 0.2918410822749138.
[I 2025-08-12 15:36:33,515] Trial 142 pruned. 
[I 2025-08-12 15:36:35,190] Trial 143 pruned. 
[I 2025-08-12 15:36:37,734] Trial 144 finished with value: 0.9167222380638123 and parameters: {'conv_layers': 2, 'conv_activation': 'sigmoid', 'conv_kernel_size': 7, 'conv_batchnorm': False, 'adaptive_pool_size': 4, 'lin_layers': 1, 'lin_activation': 'relu', 'lin_batchnorm': False, 'lr': 0.0001}. Best is trial 0 with value: 0.2918410822749138.
[I 2025-08-12 15:36:40,330] Trial 145 finished with value: 1.0154946446418762 and parameters: {'conv_layers': 2, 'conv_activation': 'sigmoid', 'conv_kernel_size': 7, 'conv_batchnorm': False, 'adaptive_pool_size': 4, 'lin_layers': 1, 'lin_activation': 'relu', 'lin_batchnorm': False, 'lr': 0.0001}. Best is trial 0 with value: 0.2918410822749138.
[I 2025-08-12 15:36:42,986] Trial 146 finished with value: 0.9961892068386078 and parameters: {'conv_layers': 2, 'conv_activation': 'sigmoid', 'conv_kernel_size': 7, 'conv_batchnorm': False, 'adaptive_pool_size': 2, 'lin_layers': 1, 'lin_activation': 'tanh', 'lin_batchnorm': False, 'lr': 0.0001}. Best is trial 0 with value: 0.2918410822749138.
[I 2025-08-12 15:36:43,732] Trial 147 pruned. 
[I 2025-08-12 15:36:46,722] Trial 148 pruned. 
[I 2025-08-12 15:36:50,800] Trial 149 finished with value: 1.0007205605506897 and parameters: {'conv_layers': 2, 'conv_activation': 'sigmoid', 'conv_kernel_size': 7, 'conv_batchnorm': False, 'adaptive_pool_size': 4, 'lin_layers': 1, 'lin_activation': 'relu', 'lin_batchnorm': False, 'lr': 0.0001}. Best is trial 0 with value: 0.2918410822749138.
[I 2025-08-12 15:36:53,763] Trial 150 pruned. 
[I 2025-08-12 15:36:57,160] Trial 151 finished with value: 0.968199610710144 and parameters: {'conv_layers': 2, 'conv_activation': 'sigmoid', 'conv_kernel_size': 7, 'conv_batchnorm': False, 'adaptive_pool_size': 4, 'lin_layers': 1, 'lin_activation': 'relu', 'lin_batchnorm': False, 'lr': 0.0001}. Best is trial 0 with value: 0.2918410822749138.
[I 2025-08-12 15:36:59,449] Trial 152 finished with value: 0.9705046117305756 and parameters: {'conv_layers': 2, 'conv_activation': 'sigmoid', 'conv_kernel_size': 7, 'conv_batchnorm': False, 'adaptive_pool_size': 4, 'lin_layers': 1, 'lin_activation': 'relu', 'lin_batchnorm': False, 'lr': 0.0001}. Best is trial 0 with value: 0.2918410822749138.
[I 2025-08-12 15:37:02,101] Trial 153 finished with value: 0.9952089786529541 and parameters: {'conv_layers': 2, 'conv_activation': 'sigmoid', 'conv_kernel_size': 7, 'conv_batchnorm': False, 'adaptive_pool_size': 4, 'lin_layers': 1, 'lin_activation': 'relu', 'lin_batchnorm': False, 'lr': 0.0001}. Best is trial 0 with value: 0.2918410822749138.
[I 2025-08-12 15:37:04,452] Trial 154 finished with value: 0.9842582941055298 and parameters: {'conv_layers': 2, 'conv_activation': 'sigmoid', 'conv_kernel_size': 7, 'conv_batchnorm': False, 'adaptive_pool_size': 4, 'lin_layers': 1, 'lin_activation': 'relu', 'lin_batchnorm': False, 'lr': 0.0001}. Best is trial 0 with value: 0.2918410822749138.
[I 2025-08-12 15:37:05,942] Trial 155 pruned. 
[I 2025-08-12 15:37:06,651] Trial 156 pruned. 
[I 2025-08-12 15:37:09,120] Trial 157 finished with value: 0.9932311773300171 and parameters: {'conv_layers': 2, 'conv_activation': 'sigmoid', 'conv_kernel_size': 7, 'conv_batchnorm': False, 'adaptive_pool_size': 2, 'lin_layers': 1, 'lin_activation': 'relu', 'lin_batchnorm': False, 'lr': 0.0001}. Best is trial 0 with value: 0.2918410822749138.
[I 2025-08-12 15:37:09,811] Trial 158 pruned. 
[I 2025-08-12 15:37:10,307] Trial 159 pruned. 
[I 2025-08-12 15:37:12,783] Trial 160 finished with value: 0.8134508728981018 and parameters: {'conv_layers': 3, 'conv_activation': 'sigmoid', 'conv_kernel_size': 7, 'conv_batchnorm': False, 'adaptive_pool_size': 4, 'lin_layers': 1, 'lin_activation': 'relu', 'lin_batchnorm': False, 'lr': 0.001}. Best is trial 0 with value: 0.2918410822749138.
[I 2025-08-12 15:37:15,121] Trial 161 finished with value: 1.0734769105911255 and parameters: {'conv_layers': 3, 'conv_activation': 'sigmoid', 'conv_kernel_size': 7, 'conv_batchnorm': False, 'adaptive_pool_size': 4, 'lin_layers': 1, 'lin_activation': 'relu', 'lin_batchnorm': False, 'lr': 0.001}. Best is trial 0 with value: 0.2918410822749138.
[I 2025-08-12 15:37:16,750] Trial 162 pruned. 
[I 2025-08-12 15:37:19,261] Trial 163 finished with value: 0.8071480095386505 and parameters: {'conv_layers': 3, 'conv_activation': 'sigmoid', 'conv_kernel_size': 7, 'conv_batchnorm': False, 'adaptive_pool_size': 4, 'lin_layers': 1, 'lin_activation': 'relu', 'lin_batchnorm': False, 'lr': 0.001}. Best is trial 0 with value: 0.2918410822749138.
[I 2025-08-12 15:37:21,545] Trial 164 finished with value: 1.061798334121704 and parameters: {'conv_layers': 3, 'conv_activation': 'sigmoid', 'conv_kernel_size': 7, 'conv_batchnorm': False, 'adaptive_pool_size': 4, 'lin_layers': 1, 'lin_activation': 'relu', 'lin_batchnorm': False, 'lr': 0.001}. Best is trial 0 with value: 0.2918410822749138.
[I 2025-08-12 15:37:24,586] Trial 165 finished with value: 0.9825250506401062 and parameters: {'conv_layers': 3, 'conv_activation': 'sigmoid', 'conv_kernel_size': 7, 'conv_batchnorm': False, 'adaptive_pool_size': 4, 'lin_layers': 1, 'lin_activation': 'relu', 'lin_batchnorm': False, 'lr': 0.001}. Best is trial 0 with value: 0.2918410822749138.
[I 2025-08-12 15:37:27,013] Trial 166 finished with value: 1.0747671127319336 and parameters: {'conv_layers': 3, 'conv_activation': 'sigmoid', 'conv_kernel_size': 7, 'conv_batchnorm': False, 'adaptive_pool_size': 4, 'lin_layers': 1, 'lin_activation': 'relu', 'lin_batchnorm': False, 'lr': 0.001}. Best is trial 0 with value: 0.2918410822749138.
[I 2025-08-12 15:37:29,761] Trial 167 finished with value: 1.08908212184906 and parameters: {'conv_layers': 3, 'conv_activation': 'sigmoid', 'conv_kernel_size': 7, 'conv_batchnorm': False, 'adaptive_pool_size': 4, 'lin_layers': 1, 'lin_activation': 'tanh', 'lin_batchnorm': False, 'lr': 0.001}. Best is trial 0 with value: 0.2918410822749138.
[I 2025-08-12 15:37:31,401] Trial 168 pruned. 
[I 2025-08-12 15:37:33,280] Trial 169 pruned. 
[I 2025-08-12 15:37:34,163] Trial 170 pruned. 
[I 2025-08-12 15:37:36,930] Trial 171 finished with value: 1.0464783906936646 and parameters: {'conv_layers': 4, 'conv_activation': 'sigmoid', 'conv_kernel_size': 7, 'conv_batchnorm': False, 'adaptive_pool_size': 4, 'lin_layers': 1, 'lin_activation': 'relu', 'lin_batchnorm': False, 'lr': 0.0001}. Best is trial 0 with value: 0.2918410822749138.
[I 2025-08-12 15:37:39,510] Trial 172 finished with value: 1.089435636997223 and parameters: {'conv_layers': 2, 'conv_activation': 'sigmoid', 'conv_kernel_size': 7, 'conv_batchnorm': False, 'adaptive_pool_size': 4, 'lin_layers': 3, 'lin_activation': 'relu', 'lin_batchnorm': False, 'lr': 0.0001}. Best is trial 0 with value: 0.2918410822749138.
[I 2025-08-12 15:37:41,097] Trial 173 pruned. 
[I 2025-08-12 15:37:43,846] Trial 174 finished with value: 0.9857936501502991 and parameters: {'conv_layers': 2, 'conv_activation': 'sigmoid', 'conv_kernel_size': 7, 'conv_batchnorm': False, 'adaptive_pool_size': 4, 'lin_layers': 1, 'lin_activation': 'relu', 'lin_batchnorm': False, 'lr': 0.005}. Best is trial 0 with value: 0.2918410822749138.
[I 2025-08-12 15:37:46,405] Trial 175 finished with value: 1.0268279314041138 and parameters: {'conv_layers': 2, 'conv_activation': 'sigmoid', 'conv_kernel_size': 7, 'conv_batchnorm': False, 'adaptive_pool_size': 2, 'lin_layers': 1, 'lin_activation': 'relu', 'lin_batchnorm': False, 'lr': 0.0001}. Best is trial 0 with value: 0.2918410822749138.
[I 2025-08-12 15:37:46,867] Trial 176 pruned. 
[I 2025-08-12 15:37:49,449] Trial 177 finished with value: 0.928170919418335 and parameters: {'conv_layers': 2, 'conv_activation': 'sigmoid', 'conv_kernel_size': 7, 'conv_batchnorm': False, 'adaptive_pool_size': 4, 'lin_layers': 1, 'lin_activation': 'tanh', 'lin_batchnorm': False, 'lr': 0.0001}. Best is trial 0 with value: 0.2918410822749138.
[I 2025-08-12 15:37:52,126] Trial 178 finished with value: 1.0630602538585663 and parameters: {'conv_layers': 4, 'conv_activation': 'sigmoid', 'conv_kernel_size': 7, 'conv_batchnorm': False, 'adaptive_pool_size': 4, 'lin_layers': 1, 'lin_activation': 'tanh', 'lin_batchnorm': False, 'lr': 0.001}. Best is trial 0 with value: 0.2918410822749138.
[I 2025-08-12 15:37:53,754] Trial 179 pruned. 
[I 2025-08-12 15:37:56,009] Trial 180 finished with value: 0.9424603879451752 and parameters: {'conv_layers': 2, 'conv_activation': 'sigmoid', 'conv_kernel_size': 7, 'conv_batchnorm': False, 'adaptive_pool_size': 4, 'lin_layers': 1, 'lin_activation': 'tanh', 'lin_batchnorm': False, 'lr': 0.0001}. Best is trial 0 with value: 0.2918410822749138.
[I 2025-08-12 15:37:57,688] Trial 181 pruned. 
[I 2025-08-12 15:37:59,428] Trial 182 pruned. 
[I 2025-08-12 15:38:00,893] Trial 183 pruned. 
[I 2025-08-12 15:38:03,185] Trial 184 finished with value: 0.8732697367668152 and parameters: {'conv_layers': 2, 'conv_activation': 'sigmoid', 'conv_kernel_size': 7, 'conv_batchnorm': False, 'adaptive_pool_size': 4, 'lin_layers': 1, 'lin_activation': 'tanh', 'lin_batchnorm': False, 'lr': 0.0001}. Best is trial 0 with value: 0.2918410822749138.
[I 2025-08-12 15:38:04,884] Trial 185 pruned. 
[I 2025-08-12 15:38:05,649] Trial 186 pruned. 
[I 2025-08-12 15:38:07,256] Trial 187 pruned. 
[I 2025-08-12 15:38:09,009] Trial 188 pruned. 
[I 2025-08-12 15:38:09,466] Trial 189 pruned. 
[I 2025-08-12 15:38:10,006] Trial 190 pruned. 
[I 2025-08-12 15:38:11,449] Trial 191 pruned. 
[I 2025-08-12 15:38:13,183] Trial 192 pruned. 
[I 2025-08-12 15:38:14,009] Trial 193 pruned. 
[I 2025-08-12 15:38:14,530] Trial 194 pruned. 
[I 2025-08-12 15:38:16,978] Trial 195 finished with value: 0.8752584457397461 and parameters: {'conv_layers': 2, 'conv_activation': 'sigmoid', 'conv_kernel_size': 7, 'conv_batchnorm': False, 'adaptive_pool_size': 4, 'lin_layers': 1, 'lin_activation': 'relu', 'lin_batchnorm': False, 'lr': 0.0001}. Best is trial 0 with value: 0.2918410822749138.
[I 2025-08-12 15:38:18,755] Trial 196 pruned. 
[I 2025-08-12 15:38:19,390] Trial 197 pruned. 
[I 2025-08-12 15:38:20,908] Trial 198 pruned. 
[I 2025-08-12 15:38:23,522] Trial 199 finished with value: 1.077225923538208 and parameters: {'conv_layers': 3, 'conv_activation': 'sigmoid', 'conv_kernel_size': 7, 'conv_batchnorm': False, 'adaptive_pool_size': 3, 'lin_layers': 1, 'lin_activation': 'relu', 'lin_batchnorm': False, 'lr': 0.0001}. Best is trial 0 with value: 0.2918410822749138.
[I 2025-08-12 15:38:26,163] Trial 200 finished with value: 1.0667146146297455 and parameters: {'conv_layers': 2, 'conv_activation': 'sigmoid', 'conv_kernel_size': 7, 'conv_batchnorm': False, 'adaptive_pool_size': 4, 'lin_layers': 2, 'lin_activation': 'relu', 'lin_batchnorm': False, 'lr': 0.0001}. Best is trial 0 with value: 0.2918410822749138.
[I 2025-08-12 15:38:27,813] Trial 201 pruned. 
[I 2025-08-12 15:38:30,497] Trial 202 finished with value: 0.9843107163906097 and parameters: {'conv_layers': 2, 'conv_activation': 'sigmoid', 'conv_kernel_size': 7, 'conv_batchnorm': False, 'adaptive_pool_size': 4, 'lin_layers': 1, 'lin_activation': 'relu', 'lin_batchnorm': False, 'lr': 0.0001}. Best is trial 0 with value: 0.2918410822749138.
[I 2025-08-12 15:38:33,066] Trial 203 finished with value: 1.0102028846740723 and parameters: {'conv_layers': 2, 'conv_activation': 'sigmoid', 'conv_kernel_size': 7, 'conv_batchnorm': False, 'adaptive_pool_size': 4, 'lin_layers': 1, 'lin_activation': 'relu', 'lin_batchnorm': False, 'lr': 0.0001}. Best is trial 0 with value: 0.2918410822749138.
[I 2025-08-12 15:38:35,666] Trial 204 finished with value: 0.9391520023345947 and parameters: {'conv_layers': 2, 'conv_activation': 'sigmoid', 'conv_kernel_size': 7, 'conv_batchnorm': False, 'adaptive_pool_size': 4, 'lin_layers': 1, 'lin_activation': 'relu', 'lin_batchnorm': False, 'lr': 0.0001}. Best is trial 0 with value: 0.2918410822749138.
[I 2025-08-12 15:38:36,218] Trial 205 pruned. 
[I 2025-08-12 15:38:38,880] Trial 206 finished with value: 0.8982406258583069 and parameters: {'conv_layers': 2, 'conv_activation': 'sigmoid', 'conv_kernel_size': 7, 'conv_batchnorm': False, 'adaptive_pool_size': 4, 'lin_layers': 1, 'lin_activation': 'relu', 'lin_batchnorm': False, 'lr': 0.0001}. Best is trial 0 with value: 0.2918410822749138.
[I 2025-08-12 15:38:40,688] Trial 207 pruned. 
[I 2025-08-12 15:38:43,421] Trial 208 finished with value: 1.0278209447860718 and parameters: {'conv_layers': 2, 'conv_activation': 'sigmoid', 'conv_kernel_size': 5, 'conv_batchnorm': False, 'adaptive_pool_size': 4, 'lin_layers': 1, 'lin_activation': 'tanh', 'lin_batchnorm': False, 'lr': 0.0001}. Best is trial 0 with value: 0.2918410822749138.
[I 2025-08-12 15:38:46,529] Trial 209 finished with value: 1.0055447220802307 and parameters: {'conv_layers': 2, 'conv_activation': 'sigmoid', 'conv_kernel_size': 7, 'conv_batchnorm': False, 'adaptive_pool_size': 4, 'lin_layers': 1, 'lin_activation': 'relu', 'lin_batchnorm': False, 'lr': 0.0001}. Best is trial 0 with value: 0.2918410822749138.
[I 2025-08-12 15:38:48,934] Trial 210 finished with value: 0.9732078909873962 and parameters: {'conv_layers': 2, 'conv_activation': 'sigmoid', 'conv_kernel_size': 7, 'conv_batchnorm': False, 'adaptive_pool_size': 4, 'lin_layers': 1, 'lin_activation': 'relu', 'lin_batchnorm': False, 'lr': 0.005}. Best is trial 0 with value: 0.2918410822749138.
[I 2025-08-12 15:38:51,726] Trial 211 finished with value: 1.098081648349762 and parameters: {'conv_layers': 2, 'conv_activation': 'sigmoid', 'conv_kernel_size': 7, 'conv_batchnorm': False, 'adaptive_pool_size': 4, 'lin_layers': 3, 'lin_activation': 'relu', 'lin_batchnorm': False, 'lr': 0.0001}. Best is trial 0 with value: 0.2918410822749138.
[I 2025-08-12 15:38:54,236] Trial 212 finished with value: 1.0182849168777466 and parameters: {'conv_layers': 2, 'conv_activation': 'sigmoid', 'conv_kernel_size': 7, 'conv_batchnorm': False, 'adaptive_pool_size': 4, 'lin_layers': 1, 'lin_activation': 'relu', 'lin_batchnorm': False, 'lr': 0.0001}. Best is trial 0 with value: 0.2918410822749138.
[I 2025-08-12 15:38:57,259] Trial 213 finished with value: 0.9211380481719971 and parameters: {'conv_layers': 2, 'conv_activation': 'sigmoid', 'conv_kernel_size': 7, 'conv_batchnorm': False, 'adaptive_pool_size': 4, 'lin_layers': 1, 'lin_activation': 'relu', 'lin_batchnorm': False, 'lr': 0.0001}. Best is trial 0 with value: 0.2918410822749138.
[I 2025-08-12 15:38:59,105] Trial 214 pruned. 
[I 2025-08-12 15:39:01,815] Trial 215 finished with value: 1.0523127317428589 and parameters: {'conv_layers': 4, 'conv_activation': 'sigmoid', 'conv_kernel_size': 7, 'conv_batchnorm': False, 'adaptive_pool_size': 4, 'lin_layers': 1, 'lin_activation': 'relu', 'lin_batchnorm': False, 'lr': 0.0001}. Best is trial 0 with value: 0.2918410822749138.
[I 2025-08-12 15:39:04,328] Trial 216 finished with value: 0.9229830503463745 and parameters: {'conv_layers': 2, 'conv_activation': 'sigmoid', 'conv_kernel_size': 7, 'conv_batchnorm': False, 'adaptive_pool_size': 4, 'lin_layers': 1, 'lin_activation': 'relu', 'lin_batchnorm': False, 'lr': 0.0001}. Best is trial 0 with value: 0.2918410822749138.
[I 2025-08-12 15:39:07,116] Trial 217 finished with value: 1.0495810508728027 and parameters: {'conv_layers': 2, 'conv_activation': 'sigmoid', 'conv_kernel_size': 7, 'conv_batchnorm': False, 'adaptive_pool_size': 4, 'lin_layers': 1, 'lin_activation': 'relu', 'lin_batchnorm': False, 'lr': 0.0001}. Best is trial 0 with value: 0.2918410822749138.
[I 2025-08-12 15:39:08,768] Trial 218 pruned. 
[I 2025-08-12 15:39:11,800] Trial 219 finished with value: 0.9148343801498413 and parameters: {'conv_layers': 2, 'conv_activation': 'sigmoid', 'conv_kernel_size': 7, 'conv_batchnorm': False, 'adaptive_pool_size': 4, 'lin_layers': 1, 'lin_activation': 'relu', 'lin_batchnorm': False, 'lr': 0.0001}. Best is trial 0 with value: 0.2918410822749138.
[I 2025-08-12 15:39:13,330] Trial 220 pruned. 
[I 2025-08-12 15:39:15,137] Trial 221 pruned. 
[I 2025-08-12 15:39:16,919] Trial 222 pruned. 
[I 2025-08-12 15:39:19,561] Trial 223 finished with value: 0.9652172029018402 and parameters: {'conv_layers': 2, 'conv_activation': 'sigmoid', 'conv_kernel_size': 7, 'conv_batchnorm': False, 'adaptive_pool_size': 4, 'lin_layers': 1, 'lin_activation': 'relu', 'lin_batchnorm': False, 'lr': 0.0001}. Best is trial 0 with value: 0.2918410822749138.
[I 2025-08-12 15:39:22,414] Trial 224 finished with value: 0.96529820561409 and parameters: {'conv_layers': 2, 'conv_activation': 'sigmoid', 'conv_kernel_size': 7, 'conv_batchnorm': False, 'adaptive_pool_size': 4, 'lin_layers': 1, 'lin_activation': 'relu', 'lin_batchnorm': False, 'lr': 0.0001}. Best is trial 0 with value: 0.2918410822749138.
[I 2025-08-12 15:39:25,137] Trial 225 finished with value: 0.9736129939556122 and parameters: {'conv_layers': 2, 'conv_activation': 'sigmoid', 'conv_kernel_size': 7, 'conv_batchnorm': False, 'adaptive_pool_size': 4, 'lin_layers': 1, 'lin_activation': 'relu', 'lin_batchnorm': False, 'lr': 0.0001}. Best is trial 0 with value: 0.2918410822749138.
[I 2025-08-12 15:39:28,069] Trial 226 finished with value: 0.9471250772476196 and parameters: {'conv_layers': 2, 'conv_activation': 'sigmoid', 'conv_kernel_size': 7, 'conv_batchnorm': False, 'adaptive_pool_size': 4, 'lin_layers': 1, 'lin_activation': 'relu', 'lin_batchnorm': False, 'lr': 0.0001}. Best is trial 0 with value: 0.2918410822749138.
[I 2025-08-12 15:39:30,950] Trial 227 finished with value: 1.0337941646575928 and parameters: {'conv_layers': 2, 'conv_activation': 'sigmoid', 'conv_kernel_size': 7, 'conv_batchnorm': False, 'adaptive_pool_size': 2, 'lin_layers': 1, 'lin_activation': 'relu', 'lin_batchnorm': False, 'lr': 0.0001}. Best is trial 0 with value: 0.2918410822749138.
[I 2025-08-12 15:39:31,778] Trial 228 pruned. 
[I 2025-08-12 15:39:32,642] Trial 229 pruned. 
[I 2025-08-12 15:39:35,509] Trial 230 finished with value: 0.8850405812263489 and parameters: {'conv_layers': 2, 'conv_activation': 'sigmoid', 'conv_kernel_size': 7, 'conv_batchnorm': False, 'adaptive_pool_size': 4, 'lin_layers': 1, 'lin_activation': 'relu', 'lin_batchnorm': False, 'lr': 0.0001}. Best is trial 0 with value: 0.2918410822749138.
[I 2025-08-12 15:39:38,254] Trial 231 finished with value: 0.974574625492096 and parameters: {'conv_layers': 2, 'conv_activation': 'sigmoid', 'conv_kernel_size': 7, 'conv_batchnorm': False, 'adaptive_pool_size': 4, 'lin_layers': 1, 'lin_activation': 'relu', 'lin_batchnorm': False, 'lr': 0.0001}. Best is trial 0 with value: 0.2918410822749138.
[I 2025-08-12 15:39:41,075] Trial 232 finished with value: 0.9655949473381042 and parameters: {'conv_layers': 2, 'conv_activation': 'sigmoid', 'conv_kernel_size': 7, 'conv_batchnorm': False, 'adaptive_pool_size': 4, 'lin_layers': 1, 'lin_activation': 'relu', 'lin_batchnorm': False, 'lr': 0.0001}. Best is trial 0 with value: 0.2918410822749138.
[I 2025-08-12 15:39:42,801] Trial 233 pruned. 
[I 2025-08-12 15:39:45,524] Trial 234 finished with value: 0.9225468337535858 and parameters: {'conv_layers': 2, 'conv_activation': 'sigmoid', 'conv_kernel_size': 7, 'conv_batchnorm': False, 'adaptive_pool_size': 4, 'lin_layers': 1, 'lin_activation': 'relu', 'lin_batchnorm': False, 'lr': 0.0001}. Best is trial 0 with value: 0.2918410822749138.
[I 2025-08-12 15:39:46,489] Trial 235 pruned. 
[I 2025-08-12 15:39:47,383] Trial 236 pruned. 
[I 2025-08-12 15:39:49,243] Trial 237 pruned. 
[I 2025-08-12 15:39:52,266] Trial 238 finished with value: 1.0382875502109528 and parameters: {'conv_layers': 2, 'conv_activation': 'sigmoid', 'conv_kernel_size': 7, 'conv_batchnorm': False, 'adaptive_pool_size': 4, 'lin_layers': 1, 'lin_activation': 'relu', 'lin_batchnorm': False, 'lr': 0.0001}. Best is trial 0 with value: 0.2918410822749138.
[I 2025-08-12 15:39:53,202] Trial 239 pruned. 
[I 2025-08-12 15:39:54,147] Trial 240 pruned. 
[I 2025-08-12 15:39:57,117] Trial 241 finished with value: 0.984660267829895 and parameters: {'conv_layers': 2, 'conv_activation': 'sigmoid', 'conv_kernel_size': 7, 'conv_batchnorm': False, 'adaptive_pool_size': 4, 'lin_layers': 1, 'lin_activation': 'relu', 'lin_batchnorm': False, 'lr': 0.0001}. Best is trial 0 with value: 0.2918410822749138.
