[I 2025-08-12 15:43:53,643] Trial 357 finished with value: 0.9513792097568512 and parameters: {'conv_layers': 3, 'conv_activation': 'sigmoid', 'conv_kernel_size': 5, 'conv_batchnorm': False, 'adaptive_pool_size': 2, 'lin_layers': 3, 'lin_activation': 'relu', 'lin_batchnorm': False, 'lr': 0.001}. Best is trial 275 with value: 0.21435055881738663.
[I 2025-08-12 15:43:55,830] Trial 358 finished with value: 0.8752390742301941 and parameters: {'conv_layers': 3, 'conv_activation': 'sigmoid', 'conv_kernel_size': 5, 'conv_batchnorm': True, 'adaptive_pool_size': 2, 'lin_layers': 3, 'lin_activation': 'relu', 'lin_batchnorm': False, 'lr': 0.001}. Best is trial 275 with value: 0.21435055881738663.
[I 2025-08-12 15:43:57,720] Trial 359 pruned. 
[I 2025-08-12 15:43:58,468] Trial 360 pruned. 
[I 2025-08-12 15:43:59,734] Trial 361 pruned. 
[I 2025-08-12 15:44:01,915] Trial 362 finished with value: 0.6510344743728638 and parameters: {'conv_layers': 3, 'conv_activation': 'sigmoid', 'conv_kernel_size': 5, 'conv_batchnorm': False, 'adaptive_pool_size': 2, 'lin_layers': 3, 'lin_activation': 'relu', 'lin_batchnorm': False, 'lr': 0.001}. Best is trial 275 with value: 0.21435055881738663.
[I 2025-08-12 15:44:02,751] Trial 363 pruned. 
[I 2025-08-12 15:44:03,490] Trial 364 pruned. 
[I 2025-08-12 15:44:04,027] Trial 365 pruned. 
[I 2025-08-12 15:44:04,671] Trial 366 pruned. 
[I 2025-08-12 15:44:05,180] Trial 367 pruned. 
[I 2025-08-12 15:44:06,766] Trial 368 pruned. 
[I 2025-08-12 15:44:09,967] Trial 369 finished with value: 1.0811907649040222 and parameters: {'conv_layers': 3, 'conv_activation': 'sigmoid', 'conv_kernel_size': 5, 'conv_batchnorm': False, 'adaptive_pool_size': 2, 'lin_layers': 3, 'lin_activation': 'relu', 'lin_batchnorm': False, 'lr': 0.001}. Best is trial 275 with value: 0.21435055881738663.
[I 2025-08-12 15:44:11,358] Trial 370 pruned. 
[I 2025-08-12 15:44:12,045] Trial 371 pruned. 
[I 2025-08-12 15:44:15,121] Trial 372 finished with value: 0.5371263176202774 and parameters: {'conv_layers': 3, 'conv_activation': 'sigmoid', 'conv_kernel_size': 5, 'conv_batchnorm': False, 'adaptive_pool_size': 3, 'lin_layers': 3, 'lin_activation': 'relu', 'lin_batchnorm': False, 'lr': 0.001}. Best is trial 275 with value: 0.21435055881738663.
[I 2025-08-12 15:44:16,758] Trial 373 pruned. 
[I 2025-08-12 15:44:18,984] Trial 374 pruned. 
[I 2025-08-12 15:44:21,202] Trial 375 finished with value: 0.7266111969947815 and parameters: {'conv_layers': 3, 'conv_activation': 'sigmoid', 'conv_kernel_size': 5, 'conv_batchnorm': False, 'adaptive_pool_size': 3, 'lin_layers': 3, 'lin_activation': 'relu', 'lin_batchnorm': False, 'lr': 0.001}. Best is trial 275 with value: 0.21435055881738663.
[I 2025-08-12 15:44:23,335] Trial 376 pruned. 
[I 2025-08-12 15:44:25,616] Trial 377 finished with value: 1.0718009769916534 and parameters: {'conv_layers': 3, 'conv_activation': 'sigmoid', 'conv_kernel_size': 5, 'conv_batchnorm': False, 'adaptive_pool_size': 3, 'lin_layers': 3, 'lin_activation': 'relu', 'lin_batchnorm': False, 'lr': 0.001}. Best is trial 275 with value: 0.21435055881738663.
[I 2025-08-12 15:44:28,425] Trial 378 finished with value: 0.8666625916957855 and parameters: {'conv_layers': 3, 'conv_activation': 'sigmoid', 'conv_kernel_size': 5, 'conv_batchnorm': False, 'adaptive_pool_size': 3, 'lin_layers': 3, 'lin_activation': 'relu', 'lin_batchnorm': False, 'lr': 0.001}. Best is trial 275 with value: 0.21435055881738663.
[I 2025-08-12 15:44:30,585] Trial 379 finished with value: 1.0796867609024048 and parameters: {'conv_layers': 3, 'conv_activation': 'sigmoid', 'conv_kernel_size': 5, 'conv_batchnorm': False, 'adaptive_pool_size': 3, 'lin_layers': 3, 'lin_activation': 'relu', 'lin_batchnorm': False, 'lr': 0.001}. Best is trial 275 with value: 0.21435055881738663.
[I 2025-08-12 15:44:33,244] Trial 380 finished with value: 0.6906954050064087 and parameters: {'conv_layers': 3, 'conv_activation': 'sigmoid', 'conv_kernel_size': 5, 'conv_batchnorm': False, 'adaptive_pool_size': 3, 'lin_layers': 3, 'lin_activation': 'relu', 'lin_batchnorm': False, 'lr': 0.001}. Best is trial 275 with value: 0.21435055881738663.
[I 2025-08-12 15:44:35,019] Trial 381 pruned. 
[I 2025-08-12 15:44:37,419] Trial 382 finished with value: 0.71773761510849 and parameters: {'conv_layers': 3, 'conv_activation': 'sigmoid', 'conv_kernel_size': 5, 'conv_batchnorm': False, 'adaptive_pool_size': 3, 'lin_layers': 3, 'lin_activation': 'relu', 'lin_batchnorm': False, 'lr': 0.001}. Best is trial 275 with value: 0.21435055881738663.
[I 2025-08-12 15:44:40,356] Trial 383 finished with value: 0.6302844732999802 and parameters: {'conv_layers': 3, 'conv_activation': 'sigmoid', 'conv_kernel_size': 5, 'conv_batchnorm': False, 'adaptive_pool_size': 3, 'lin_layers': 3, 'lin_activation': 'relu', 'lin_batchnorm': False, 'lr': 0.001}. Best is trial 275 with value: 0.21435055881738663.
[I 2025-08-12 15:44:42,673] Trial 384 finished with value: 1.10157710313797 and parameters: {'conv_layers': 3, 'conv_activation': 'sigmoid', 'conv_kernel_size': 5, 'conv_batchnorm': False, 'adaptive_pool_size': 3, 'lin_layers': 3, 'lin_activation': 'relu', 'lin_batchnorm': False, 'lr': 0.001}. Best is trial 275 with value: 0.21435055881738663.
[I 2025-08-12 15:44:45,480] Trial 385 finished with value: 0.5711233019828796 and parameters: {'conv_layers': 3, 'conv_activation': 'sigmoid', 'conv_kernel_size': 5, 'conv_batchnorm': False, 'adaptive_pool_size': 3, 'lin_layers': 3, 'lin_activation': 'relu', 'lin_batchnorm': False, 'lr': 0.001}. Best is trial 275 with value: 0.21435055881738663.
[I 2025-08-12 15:44:47,675] Trial 386 finished with value: 1.0067956447601318 and parameters: {'conv_layers': 3, 'conv_activation': 'sigmoid', 'conv_kernel_size': 5, 'conv_batchnorm': False, 'adaptive_pool_size': 3, 'lin_layers': 3, 'lin_activation': 'relu', 'lin_batchnorm': False, 'lr': 0.001}. Best is trial 275 with value: 0.21435055881738663.
[I 2025-08-12 15:44:50,813] Trial 387 finished with value: 0.36988459900021553 and parameters: {'conv_layers': 3, 'conv_activation': 'sigmoid', 'conv_kernel_size': 5, 'conv_batchnorm': False, 'adaptive_pool_size': 3, 'lin_layers': 3, 'lin_activation': 'relu', 'lin_batchnorm': False, 'lr': 0.001}. Best is trial 275 with value: 0.21435055881738663.
[I 2025-08-12 15:44:53,706] Trial 388 finished with value: 1.0330109596252441 and parameters: {'conv_layers': 3, 'conv_activation': 'sigmoid', 'conv_kernel_size': 5, 'conv_batchnorm': False, 'adaptive_pool_size': 3, 'lin_layers': 3, 'lin_activation': 'relu', 'lin_batchnorm': False, 'lr': 0.001}. Best is trial 275 with value: 0.21435055881738663.
[I 2025-08-12 15:44:54,328] Trial 389 pruned. 
[I 2025-08-12 15:44:55,512] Trial 390 pruned. 
[I 2025-08-12 15:44:56,769] Trial 391 pruned. 
[I 2025-08-12 15:44:57,257] Trial 392 pruned. 
[I 2025-08-12 15:45:00,283] Trial 393 finished with value: 1.0462106466293335 and parameters: {'conv_layers': 3, 'conv_activation': 'sigmoid', 'conv_kernel_size': 5, 'conv_batchnorm': False, 'adaptive_pool_size': 3, 'lin_layers': 3, 'lin_activation': 'relu', 'lin_batchnorm': False, 'lr': 0.001}. Best is trial 275 with value: 0.21435055881738663.
[I 2025-08-12 15:45:02,626] Trial 394 finished with value: 1.0865728259086609 and parameters: {'conv_layers': 3, 'conv_activation': 'sigmoid', 'conv_kernel_size': 5, 'conv_batchnorm': False, 'adaptive_pool_size': 3, 'lin_layers': 3, 'lin_activation': 'relu', 'lin_batchnorm': False, 'lr': 0.001}. Best is trial 275 with value: 0.21435055881738663.
[I 2025-08-12 15:45:04,533] Trial 395 pruned. 
[I 2025-08-12 15:45:05,026] Trial 396 pruned. 
[I 2025-08-12 15:45:06,930] Trial 397 finished with value: 1.04646235704422 and parameters: {'conv_layers': 3, 'conv_activation': 'sigmoid', 'conv_kernel_size': 5, 'conv_batchnorm': False, 'adaptive_pool_size': 3, 'lin_layers': 3, 'lin_activation': 'relu', 'lin_batchnorm': False, 'lr': 0.001}. Best is trial 275 with value: 0.21435055881738663.
[I 2025-08-12 15:45:09,540] Trial 398 pruned. 
[I 2025-08-12 15:45:10,111] Trial 399 pruned. 
[I 2025-08-12 15:45:11,312] Trial 400 pruned. 
[I 2025-08-12 15:45:13,753] Trial 401 finished with value: 0.8859400749206543 and parameters: {'conv_layers': 3, 'conv_activation': 'sigmoid', 'conv_kernel_size': 5, 'conv_batchnorm': False, 'adaptive_pool_size': 3, 'lin_layers': 3, 'lin_activation': 'relu', 'lin_batchnorm': False, 'lr': 0.001}. Best is trial 275 with value: 0.21435055881738663.
[I 2025-08-12 15:45:14,842] Trial 402 pruned. 
[I 2025-08-12 15:45:16,915] Trial 403 finished with value: 0.6938713788986206 and parameters: {'conv_layers': 3, 'conv_activation': 'sigmoid', 'conv_kernel_size': 5, 'conv_batchnorm': False, 'adaptive_pool_size': 3, 'lin_layers': 3, 'lin_activation': 'relu', 'lin_batchnorm': False, 'lr': 0.001}. Best is trial 275 with value: 0.21435055881738663.
[I 2025-08-12 15:45:19,480] Trial 404 finished with value: 1.0677840411663055 and parameters: {'conv_layers': 3, 'conv_activation': 'sigmoid', 'conv_kernel_size': 5, 'conv_batchnorm': False, 'adaptive_pool_size': 3, 'lin_layers': 3, 'lin_activation': 'relu', 'lin_batchnorm': False, 'lr': 0.001}. Best is trial 275 with value: 0.21435055881738663.
[I 2025-08-12 15:45:21,565] Trial 405 finished with value: 1.12040376663208 and parameters: {'conv_layers': 3, 'conv_activation': 'sigmoid', 'conv_kernel_size': 5, 'conv_batchnorm': False, 'adaptive_pool_size': 3, 'lin_layers': 3, 'lin_activation': 'relu', 'lin_batchnorm': False, 'lr': 0.001}. Best is trial 275 with value: 0.21435055881738663.
[I 2025-08-12 15:45:24,098] Trial 406 finished with value: 1.0797097086906433 and parameters: {'conv_layers': 3, 'conv_activation': 'sigmoid', 'conv_kernel_size': 5, 'conv_batchnorm': False, 'adaptive_pool_size': 3, 'lin_layers': 3, 'lin_activation': 'relu', 'lin_batchnorm': False, 'lr': 0.001}. Best is trial 275 with value: 0.21435055881738663.
[I 2025-08-12 15:45:26,442] Trial 407 finished with value: 0.7532193958759308 and parameters: {'conv_layers': 3, 'conv_activation': 'sigmoid', 'conv_kernel_size': 5, 'conv_batchnorm': False, 'adaptive_pool_size': 3, 'lin_layers': 3, 'lin_activation': 'relu', 'lin_batchnorm': False, 'lr': 0.001}. Best is trial 275 with value: 0.21435055881738663.
[I 2025-08-12 15:45:27,957] Trial 408 pruned. 
[I 2025-08-12 15:45:30,914] Trial 409 finished with value: 1.0544106662273407 and parameters: {'conv_layers': 3, 'conv_activation': 'sigmoid', 'conv_kernel_size': 5, 'conv_batchnorm': False, 'adaptive_pool_size': 3, 'lin_layers': 3, 'lin_activation': 'relu', 'lin_batchnorm': False, 'lr': 0.001}. Best is trial 275 with value: 0.21435055881738663.
[I 2025-08-12 15:45:31,482] Trial 410 pruned. 
[I 2025-08-12 15:45:33,586] Trial 411 finished with value: 0.9998680353164673 and parameters: {'conv_layers': 3, 'conv_activation': 'sigmoid', 'conv_kernel_size': 5, 'conv_batchnorm': False, 'adaptive_pool_size': 3, 'lin_layers': 3, 'lin_activation': 'relu', 'lin_batchnorm': False, 'lr': 0.001}. Best is trial 275 with value: 0.21435055881738663.
[I 2025-08-12 15:45:36,839] Trial 412 finished with value: 1.0931655168533325 and parameters: {'conv_layers': 3, 'conv_activation': 'sigmoid', 'conv_kernel_size': 5, 'conv_batchnorm': False, 'adaptive_pool_size': 3, 'lin_layers': 3, 'lin_activation': 'relu', 'lin_batchnorm': False, 'lr': 0.001}. Best is trial 275 with value: 0.21435055881738663.
[I 2025-08-12 15:45:38,552] Trial 413 pruned. 
[I 2025-08-12 15:45:41,388] Trial 414 finished with value: 1.0818108916282654 and parameters: {'conv_layers': 3, 'conv_activation': 'sigmoid', 'conv_kernel_size': 5, 'conv_batchnorm': False, 'adaptive_pool_size': 3, 'lin_layers': 3, 'lin_activation': 'relu', 'lin_batchnorm': False, 'lr': 0.001}. Best is trial 275 with value: 0.21435055881738663.
[I 2025-08-12 15:45:43,269] Trial 415 pruned. 
[I 2025-08-12 15:45:46,247] Trial 416 finished with value: 1.0745874643325806 and parameters: {'conv_layers': 3, 'conv_activation': 'sigmoid', 'conv_kernel_size': 5, 'conv_batchnorm': False, 'adaptive_pool_size': 3, 'lin_layers': 3, 'lin_activation': 'relu', 'lin_batchnorm': False, 'lr': 0.005}. Best is trial 275 with value: 0.21435055881738663.
[I 2025-08-12 15:45:46,912] Trial 417 pruned. 
[I 2025-08-12 15:45:49,198] Trial 418 finished with value: 0.6547264009714127 and parameters: {'conv_layers': 3, 'conv_activation': 'sigmoid', 'conv_kernel_size': 5, 'conv_batchnorm': False, 'adaptive_pool_size': 2, 'lin_layers': 3, 'lin_activation': 'relu', 'lin_batchnorm': False, 'lr': 0.001}. Best is trial 275 with value: 0.21435055881738663.
[I 2025-08-12 15:45:52,275] Trial 419 finished with value: 1.093363344669342 and parameters: {'conv_layers': 3, 'conv_activation': 'sigmoid', 'conv_kernel_size': 5, 'conv_batchnorm': False, 'adaptive_pool_size': 3, 'lin_layers': 3, 'lin_activation': 'relu', 'lin_batchnorm': False, 'lr': 0.001}. Best is trial 275 with value: 0.21435055881738663.
[I 2025-08-12 15:45:54,907] Trial 420 finished with value: 0.7857308387756348 and parameters: {'conv_layers': 3, 'conv_activation': 'sigmoid', 'conv_kernel_size': 5, 'conv_batchnorm': False, 'adaptive_pool_size': 2, 'lin_layers': 3, 'lin_activation': 'relu', 'lin_batchnorm': False, 'lr': 0.001}. Best is trial 275 with value: 0.21435055881738663.
[I 2025-08-12 15:45:57,608] Trial 421 finished with value: 1.0550454258918762 and parameters: {'conv_layers': 3, 'conv_activation': 'sigmoid', 'conv_kernel_size': 5, 'conv_batchnorm': False, 'adaptive_pool_size': 3, 'lin_layers': 3, 'lin_activation': 'relu', 'lin_batchnorm': False, 'lr': 0.05}. Best is trial 275 with value: 0.21435055881738663.
[I 2025-08-12 15:45:59,110] Trial 422 pruned. 
[I 2025-08-12 15:46:01,895] Trial 423 finished with value: 0.6461665630340576 and parameters: {'conv_layers': 3, 'conv_activation': 'relu', 'conv_kernel_size': 5, 'conv_batchnorm': False, 'adaptive_pool_size': 3, 'lin_layers': 3, 'lin_activation': 'sigmoid', 'lin_batchnorm': False, 'lr': 0.001}. Best is trial 275 with value: 0.21435055881738663.
[I 2025-08-12 15:46:02,592] Trial 424 pruned. 
[I 2025-08-12 15:46:03,036] Trial 425 pruned. 
[I 2025-08-12 15:46:03,837] Trial 426 pruned. 
[I 2025-08-12 15:46:04,669] Trial 427 pruned. 
[I 2025-08-12 15:46:05,771] Trial 428 pruned. 
[I 2025-08-12 15:46:06,631] Trial 429 pruned. 
[I 2025-08-12 15:46:07,842] Trial 430 pruned. 
[I 2025-08-12 15:46:09,859] Trial 431 pruned. 
[I 2025-08-12 15:46:12,274] Trial 432 pruned. 
[I 2025-08-12 15:46:13,207] Trial 433 pruned. 
[I 2025-08-12 15:46:14,901] Trial 434 pruned. 
[I 2025-08-12 15:46:17,729] Trial 435 finished with value: 0.6416196227073669 and parameters: {'conv_layers': 3, 'conv_activation': 'sigmoid', 'conv_kernel_size': 5, 'conv_batchnorm': False, 'adaptive_pool_size': 3, 'lin_layers': 3, 'lin_activation': 'relu', 'lin_batchnorm': False, 'lr': 0.001}. Best is trial 275 with value: 0.21435055881738663.
[I 2025-08-12 15:46:20,140] Trial 436 finished with value: 0.5450948178768158 and parameters: {'conv_layers': 3, 'conv_activation': 'sigmoid', 'conv_kernel_size': 5, 'conv_batchnorm': False, 'adaptive_pool_size': 2, 'lin_layers': 3, 'lin_activation': 'relu', 'lin_batchnorm': False, 'lr': 0.001}. Best is trial 275 with value: 0.21435055881738663.
[I 2025-08-12 15:46:22,983] Trial 437 finished with value: 0.9910436570644379 and parameters: {'conv_layers': 3, 'conv_activation': 'sigmoid', 'conv_kernel_size': 5, 'conv_batchnorm': False, 'adaptive_pool_size': 3, 'lin_layers': 3, 'lin_activation': 'relu', 'lin_batchnorm': False, 'lr': 0.001}. Best is trial 275 with value: 0.21435055881738663.
[I 2025-08-12 15:46:25,385] Trial 438 finished with value: 1.0760153532028198 and parameters: {'conv_layers': 3, 'conv_activation': 'sigmoid', 'conv_kernel_size': 5, 'conv_batchnorm': False, 'adaptive_pool_size': 2, 'lin_layers': 3, 'lin_activation': 'relu', 'lin_batchnorm': False, 'lr': 0.001}. Best is trial 275 with value: 0.21435055881738663.
[I 2025-08-12 15:46:27,334] Trial 439 pruned. 
[I 2025-08-12 15:46:29,827] Trial 440 finished with value: 1.0003863275051117 and parameters: {'conv_layers': 3, 'conv_activation': 'sigmoid', 'conv_kernel_size': 5, 'conv_batchnorm': False, 'adaptive_pool_size': 2, 'lin_layers': 3, 'lin_activation': 'relu', 'lin_batchnorm': False, 'lr': 0.005}. Best is trial 275 with value: 0.21435055881738663.
[I 2025-08-12 15:46:32,708] Trial 441 finished with value: 0.9876726865768433 and parameters: {'conv_layers': 3, 'conv_activation': 'sigmoid', 'conv_kernel_size': 3, 'conv_batchnorm': False, 'adaptive_pool_size': 3, 'lin_layers': 3, 'lin_activation': 'relu', 'lin_batchnorm': False, 'lr': 0.001}. Best is trial 275 with value: 0.21435055881738663.
[I 2025-08-12 15:46:33,437] Trial 442 pruned. 
[I 2025-08-12 15:46:36,342] Trial 443 finished with value: 0.7089841663837433 and parameters: {'conv_layers': 3, 'conv_activation': 'sigmoid', 'conv_kernel_size': 5, 'conv_batchnorm': False, 'adaptive_pool_size': 3, 'lin_layers': 3, 'lin_activation': 'relu', 'lin_batchnorm': False, 'lr': 0.001}. Best is trial 275 with value: 0.21435055881738663.
[I 2025-08-12 15:46:38,915] Trial 444 finished with value: 1.0600111782550812 and parameters: {'conv_layers': 3, 'conv_activation': 'sigmoid', 'conv_kernel_size': 5, 'conv_batchnorm': False, 'adaptive_pool_size': 3, 'lin_layers': 3, 'lin_activation': 'relu', 'lin_batchnorm': False, 'lr': 0.05}. Best is trial 275 with value: 0.21435055881738663.
[I 2025-08-12 15:46:39,812] Trial 445 pruned. 
[I 2025-08-12 15:46:41,747] Trial 446 pruned. 
[I 2025-08-12 15:46:44,497] Trial 447 finished with value: 1.073138266801834 and parameters: {'conv_layers': 3, 'conv_activation': 'sigmoid', 'conv_kernel_size': 5, 'conv_batchnorm': False, 'adaptive_pool_size': 3, 'lin_layers': 3, 'lin_activation': 'relu', 'lin_batchnorm': False, 'lr': 0.001}. Best is trial 275 with value: 0.21435055881738663.
[I 2025-08-12 15:46:46,331] Trial 448 pruned. 
[I 2025-08-12 15:46:46,773] Trial 449 pruned. 
[I 2025-08-12 15:46:48,720] Trial 450 finished with value: 0.9957143366336823 and parameters: {'conv_layers': 3, 'conv_activation': 'sigmoid', 'conv_kernel_size': 5, 'conv_batchnorm': False, 'adaptive_pool_size': 3, 'lin_layers': 3, 'lin_activation': 'relu', 'lin_batchnorm': False, 'lr': 0.001}. Best is trial 275 with value: 0.21435055881738663.
[I 2025-08-12 15:46:51,262] Trial 451 finished with value: 1.0836393237113953 and parameters: {'conv_layers': 3, 'conv_activation': 'sigmoid', 'conv_kernel_size': 5, 'conv_batchnorm': False, 'adaptive_pool_size': 1, 'lin_layers': 3, 'lin_activation': 'relu', 'lin_batchnorm': False, 'lr': 0.001}. Best is trial 275 with value: 0.21435055881738663.
[I 2025-08-12 15:46:54,271] Trial 452 finished with value: 0.6406344771385193 and parameters: {'conv_layers': 3, 'conv_activation': 'sigmoid', 'conv_kernel_size': 5, 'conv_batchnorm': False, 'adaptive_pool_size': 3, 'lin_layers': 3, 'lin_activation': 'relu', 'lin_batchnorm': False, 'lr': 0.001}. Best is trial 275 with value: 0.21435055881738663.
[I 2025-08-12 15:46:55,939] Trial 453 pruned. 
[I 2025-08-12 15:46:58,804] Trial 454 finished with value: 1.052578866481781 and parameters: {'conv_layers': 3, 'conv_activation': 'sigmoid', 'conv_kernel_size': 5, 'conv_batchnorm': False, 'adaptive_pool_size': 3, 'lin_layers': 3, 'lin_activation': 'sigmoid', 'lin_batchnorm': False, 'lr': 0.001}. Best is trial 275 with value: 0.21435055881738663.
[I 2025-08-12 15:47:01,486] Trial 455 finished with value: 0.5804041922092438 and parameters: {'conv_layers': 3, 'conv_activation': 'sigmoid', 'conv_kernel_size': 5, 'conv_batchnorm': False, 'adaptive_pool_size': 3, 'lin_layers': 3, 'lin_activation': 'relu', 'lin_batchnorm': False, 'lr': 0.001}. Best is trial 275 with value: 0.21435055881738663.
[I 2025-08-12 15:47:03,860] Trial 456 finished with value: 1.0775266289710999 and parameters: {'conv_layers': 3, 'conv_activation': 'sigmoid', 'conv_kernel_size': 5, 'conv_batchnorm': False, 'adaptive_pool_size': 3, 'lin_layers': 3, 'lin_activation': 'relu', 'lin_batchnorm': False, 'lr': 0.001}. Best is trial 275 with value: 0.21435055881738663.
[I 2025-08-12 15:47:05,866] Trial 457 finished with value: 0.9750819504261017 and parameters: {'conv_layers': 3, 'conv_activation': 'sigmoid', 'conv_kernel_size': 3, 'conv_batchnorm': False, 'adaptive_pool_size': 3, 'lin_layers': 3, 'lin_activation': 'relu', 'lin_batchnorm': False, 'lr': 0.001}. Best is trial 275 with value: 0.21435055881738663.
[I 2025-08-12 15:47:06,688] Trial 458 pruned. 
[I 2025-08-12 15:47:09,191] Trial 459 finished with value: 0.6196385771036148 and parameters: {'conv_layers': 3, 'conv_activation': 'sigmoid', 'conv_kernel_size': 5, 'conv_batchnorm': False, 'adaptive_pool_size': 3, 'lin_layers': 3, 'lin_activation': 'relu', 'lin_batchnorm': False, 'lr': 0.001}. Best is trial 275 with value: 0.21435055881738663.
[I 2025-08-12 15:47:12,174] Trial 460 finished with value: 1.08725106716156 and parameters: {'conv_layers': 3, 'conv_activation': 'sigmoid', 'conv_kernel_size': 5, 'conv_batchnorm': False, 'adaptive_pool_size': 3, 'lin_layers': 3, 'lin_activation': 'relu', 'lin_batchnorm': False, 'lr': 0.001}. Best is trial 275 with value: 0.21435055881738663.
[I 2025-08-12 15:47:14,284] Trial 461 finished with value: 1.0551834404468536 and parameters: {'conv_layers': 3, 'conv_activation': 'sigmoid', 'conv_kernel_size': 5, 'conv_batchnorm': False, 'adaptive_pool_size': 3, 'lin_layers': 3, 'lin_activation': 'relu', 'lin_batchnorm': False, 'lr': 0.001}. Best is trial 275 with value: 0.21435055881738663.
[I 2025-08-12 15:47:15,731] Trial 462 pruned. 
[I 2025-08-12 15:47:18,788] Trial 463 finished with value: 0.6389452517032623 and parameters: {'conv_layers': 3, 'conv_activation': 'sigmoid', 'conv_kernel_size': 5, 'conv_batchnorm': False, 'adaptive_pool_size': 3, 'lin_layers': 3, 'lin_activation': 'relu', 'lin_batchnorm': False, 'lr': 0.001}. Best is trial 275 with value: 0.21435055881738663.
