[I 2025-08-12 15:32:16,569] A new study created in RDB with name: mandioca_baseline
[I 2025-08-12 15:32:19,365] Trial 0 finished with value: 0.2918410822749138 and parameters: {'conv_layers': 2, 'conv_activation': 'relu', 'conv_kernel_size': 7, 'conv_batchnorm': False, 'adaptive_pool_size': 2, 'lin_layers': 3, 'lin_activation': 'tanh', 'lin_batchnorm': False, 'lr': 0.001}. Best is trial 0 with value: 0.2918410822749138.
[I 2025-08-12 15:32:21,953] Trial 1 finished with value: 0.9556530714035034 and parameters: {'conv_layers': 4, 'conv_activation': 'tanh', 'conv_kernel_size': 7, 'conv_batchnorm': False, 'adaptive_pool_size': 1, 'lin_layers': 2, 'lin_activation': 'tanh', 'lin_batchnorm': False, 'lr': 0.005}. Best is trial 0 with value: 0.2918410822749138.
[I 2025-08-12 15:32:22,767] Trial 2 pruned. 
[I 2025-08-12 15:32:23,225] Trial 3 pruned. 
[I 2025-08-12 15:32:25,943] Trial 4 finished with value: 1.0943343043327332 and parameters: {'conv_layers': 4, 'conv_activation': 'sigmoid', 'conv_kernel_size': 5, 'conv_batchnorm': False, 'adaptive_pool_size': 3, 'lin_layers': 3, 'lin_activation': 'sigmoid', 'lin_batchnorm': False, 'lr': 0.0001}. Best is trial 0 with value: 0.2918410822749138.
[I 2025-08-12 15:32:26,618] Trial 5 pruned. 
[I 2025-08-12 15:32:27,275] Trial 6 pruned. 
[I 2025-08-12 15:32:27,877] Trial 7 pruned. 
[I 2025-08-12 15:32:30,550] Trial 8 finished with value: 1.059395283460617 and parameters: {'conv_layers': 4, 'conv_activation': 'sigmoid', 'conv_kernel_size': 7, 'conv_batchnorm': False, 'adaptive_pool_size': 3, 'lin_layers': 2, 'lin_activation': 'relu', 'lin_batchnorm': False, 'lr': 0.001}. Best is trial 0 with value: 0.2918410822749138.
[I 2025-08-12 15:32:32,842] Trial 9 finished with value: 0.9678069353103638 and parameters: {'conv_layers': 5, 'conv_activation': 'relu', 'conv_kernel_size': 3, 'conv_batchnorm': True, 'adaptive_pool_size': 1, 'lin_layers': 1, 'lin_activation': 'relu', 'lin_batchnorm': False, 'lr': 0.05}. Best is trial 0 with value: 0.2918410822749138.
[I 2025-08-12 15:32:33,349] Trial 10 pruned. 
[I 2025-08-12 15:32:33,753] Trial 11 pruned. 
[I 2025-08-12 15:32:34,199] Trial 12 pruned. 
[I 2025-08-12 15:32:34,848] Trial 13 pruned. 
[I 2025-08-12 15:32:35,467] Trial 14 pruned. 
[I 2025-08-12 15:32:35,939] Trial 15 pruned. 
[I 2025-08-12 15:32:36,364] Trial 16 pruned. 
[I 2025-08-12 15:32:38,559] Trial 17 finished with value: 1.0430461764335632 and parameters: {'conv_layers': 3, 'conv_activation': 'sigmoid', 'conv_kernel_size': 7, 'conv_batchnorm': False, 'adaptive_pool_size': 4, 'lin_layers': 1, 'lin_activation': 'sigmoid', 'lin_batchnorm': False, 'lr': 0.05}. Best is trial 0 with value: 0.2918410822749138.
[I 2025-08-12 15:32:38,989] Trial 18 pruned. 
[I 2025-08-12 15:32:39,525] Trial 19 pruned. 
[I 2025-08-12 15:32:42,000] Trial 20 finished with value: 1.0428885519504547 and parameters: {'conv_layers': 3, 'conv_activation': 'relu', 'conv_kernel_size': 7, 'conv_batchnorm': False, 'adaptive_pool_size': 2, 'lin_layers': 3, 'lin_activation': 'sigmoid', 'lin_batchnorm': False, 'lr': 0.005}. Best is trial 0 with value: 0.2918410822749138.
[I 2025-08-12 15:32:42,456] Trial 21 pruned. 
[I 2025-08-12 15:32:43,115] Trial 22 pruned. 
[I 2025-08-12 15:32:43,787] Trial 23 pruned. 
[I 2025-08-12 15:32:45,730] Trial 24 pruned. 
[I 2025-08-12 15:32:46,442] Trial 25 pruned. 
[I 2025-08-12 15:32:48,201] Trial 26 pruned. 
[I 2025-08-12 15:32:50,715] Trial 27 finished with value: 0.9891023635864258 and parameters: {'conv_layers': 2, 'conv_activation': 'sigmoid', 'conv_kernel_size': 7, 'conv_batchnorm': False, 'adaptive_pool_size': 4, 'lin_layers': 1, 'lin_activation': 'relu', 'lin_batchnorm': False, 'lr': 0.0001}. Best is trial 0 with value: 0.2918410822749138.
[I 2025-08-12 15:32:52,256] Trial 28 pruned. 
[I 2025-08-12 15:32:52,783] Trial 29 pruned. 
[I 2025-08-12 15:32:54,281] Trial 30 pruned. 
[I 2025-08-12 15:32:56,948] Trial 31 finished with value: 0.9641202986240387 and parameters: {'conv_layers': 2, 'conv_activation': 'sigmoid', 'conv_kernel_size': 7, 'conv_batchnorm': False, 'adaptive_pool_size': 4, 'lin_layers': 1, 'lin_activation': 'relu', 'lin_batchnorm': False, 'lr': 0.0001}. Best is trial 0 with value: 0.2918410822749138.
[I 2025-08-12 15:32:59,281] Trial 32 finished with value: 1.0028908848762512 and parameters: {'conv_layers': 2, 'conv_activation': 'sigmoid', 'conv_kernel_size': 7, 'conv_batchnorm': False, 'adaptive_pool_size': 4, 'lin_layers': 1, 'lin_activation': 'relu', 'lin_batchnorm': False, 'lr': 0.0001}. Best is trial 0 with value: 0.2918410822749138.
[I 2025-08-12 15:33:02,123] Trial 33 finished with value: 1.0655134916305542 and parameters: {'conv_layers': 3, 'conv_activation': 'sigmoid', 'conv_kernel_size': 7, 'conv_batchnorm': False, 'adaptive_pool_size': 4, 'lin_layers': 1, 'lin_activation': 'relu', 'lin_batchnorm': False, 'lr': 0.0001}. Best is trial 0 with value: 0.2918410822749138.
[I 2025-08-12 15:33:03,605] Trial 34 pruned. 
[I 2025-08-12 15:33:06,256] Trial 35 finished with value: 1.064805507659912 and parameters: {'conv_layers': 2, 'conv_activation': 'sigmoid', 'conv_kernel_size': 3, 'conv_batchnorm': False, 'adaptive_pool_size': 3, 'lin_layers': 1, 'lin_activation': 'relu', 'lin_batchnorm': False, 'lr': 0.0001}. Best is trial 0 with value: 0.2918410822749138.
[I 2025-08-12 15:33:06,778] Trial 36 pruned. 
[I 2025-08-12 15:33:07,352] Trial 37 pruned. 
[I 2025-08-12 15:33:07,846] Trial 38 pruned. 
[I 2025-08-12 15:33:08,622] Trial 39 pruned. 
[I 2025-08-12 15:33:10,262] Trial 40 pruned. 
[I 2025-08-12 15:33:12,893] Trial 41 finished with value: 0.9615117311477661 and parameters: {'conv_layers': 2, 'conv_activation': 'sigmoid', 'conv_kernel_size': 7, 'conv_batchnorm': False, 'adaptive_pool_size': 4, 'lin_layers': 1, 'lin_activation': 'relu', 'lin_batchnorm': False, 'lr': 0.0001}. Best is trial 0 with value: 0.2918410822749138.
[I 2025-08-12 15:33:13,672] Trial 42 pruned. 
[I 2025-08-12 15:33:16,366] Trial 43 finished with value: 0.9211422801017761 and parameters: {'conv_layers': 2, 'conv_activation': 'sigmoid', 'conv_kernel_size': 7, 'conv_batchnorm': False, 'adaptive_pool_size': 4, 'lin_layers': 1, 'lin_activation': 'relu', 'lin_batchnorm': False, 'lr': 0.0001}. Best is trial 0 with value: 0.2918410822749138.
[I 2025-08-12 15:33:17,793] Trial 44 pruned. 
[I 2025-08-12 15:33:19,949] Trial 45 finished with value: 0.8750061392784119 and parameters: {'conv_layers': 1, 'conv_activation': 'sigmoid', 'conv_kernel_size': 7, 'conv_batchnorm': False, 'adaptive_pool_size': 4, 'lin_layers': 2, 'lin_activation': 'relu', 'lin_batchnorm': False, 'lr': 0.0001}. Best is trial 0 with value: 0.2918410822749138.
[I 2025-08-12 15:33:21,599] Trial 46 pruned. 
[I 2025-08-12 15:33:22,284] Trial 47 pruned. 
[I 2025-08-12 15:33:23,695] Trial 48 pruned. 
[I 2025-08-12 15:33:26,489] Trial 49 finished with value: 1.0440986156463623 and parameters: {'conv_layers': 3, 'conv_activation': 'sigmoid', 'conv_kernel_size': 7, 'conv_batchnorm': False, 'adaptive_pool_size': 4, 'lin_layers': 2, 'lin_activation': 'tanh', 'lin_batchnorm': False, 'lr': 0.005}. Best is trial 0 with value: 0.2918410822749138.
[I 2025-08-12 15:33:27,813] Trial 50 pruned. 
[I 2025-08-12 15:33:30,259] Trial 51 finished with value: 0.8643542528152466 and parameters: {'conv_layers': 2, 'conv_activation': 'sigmoid', 'conv_kernel_size': 7, 'conv_batchnorm': False, 'adaptive_pool_size': 4, 'lin_layers': 1, 'lin_activation': 'relu', 'lin_batchnorm': False, 'lr': 0.0001}. Best is trial 0 with value: 0.2918410822749138.
[I 2025-08-12 15:33:31,937] Trial 52 pruned. 
[I 2025-08-12 15:33:34,285] Trial 53 finished with value: 0.9937441945075989 and parameters: {'conv_layers': 2, 'conv_activation': 'sigmoid', 'conv_kernel_size': 7, 'conv_batchnorm': False, 'adaptive_pool_size': 4, 'lin_layers': 1, 'lin_activation': 'relu', 'lin_batchnorm': False, 'lr': 0.0001}. Best is trial 0 with value: 0.2918410822749138.
[I 2025-08-12 15:33:36,855] Trial 54 finished with value: 1.0943471193313599 and parameters: {'conv_layers': 3, 'conv_activation': 'sigmoid', 'conv_kernel_size': 7, 'conv_batchnorm': False, 'adaptive_pool_size': 4, 'lin_layers': 3, 'lin_activation': 'relu', 'lin_batchnorm': False, 'lr': 0.0001}. Best is trial 0 with value: 0.2918410822749138.
[I 2025-08-12 15:33:37,595] Trial 55 pruned. 
[I 2025-08-12 15:33:40,013] Trial 56 finished with value: 1.0542011559009552 and parameters: {'conv_layers': 2, 'conv_activation': 'sigmoid', 'conv_kernel_size': 5, 'conv_batchnorm': False, 'adaptive_pool_size': 4, 'lin_layers': 1, 'lin_activation': 'relu', 'lin_batchnorm': False, 'lr': 0.0001}. Best is trial 0 with value: 0.2918410822749138.
[I 2025-08-12 15:33:40,650] Trial 57 pruned. 
[I 2025-08-12 15:33:41,748] Trial 58 pruned. 
[I 2025-08-12 15:33:44,156] Trial 59 finished with value: 1.0812267065048218 and parameters: {'conv_layers': 3, 'conv_activation': 'sigmoid', 'conv_kernel_size': 7, 'conv_batchnorm': False, 'adaptive_pool_size': 2, 'lin_layers': 2, 'lin_activation': 'relu', 'lin_batchnorm': False, 'lr': 0.005}. Best is trial 0 with value: 0.2918410822749138.
[I 2025-08-12 15:33:45,630] Trial 60 pruned. 
[I 2025-08-12 15:33:48,297] Trial 61 finished with value: 1.0036251246929169 and parameters: {'conv_layers': 2, 'conv_activation': 'sigmoid', 'conv_kernel_size': 7, 'conv_batchnorm': False, 'adaptive_pool_size': 4, 'lin_layers': 1, 'lin_activation': 'relu', 'lin_batchnorm': False, 'lr': 0.0001}. Best is trial 0 with value: 0.2918410822749138.
[I 2025-08-12 15:33:50,010] Trial 62 pruned. 
[I 2025-08-12 15:33:50,892] Trial 63 pruned. 
[I 2025-08-12 15:33:53,675] Trial 64 finished with value: 0.9714608788490295 and parameters: {'conv_layers': 2, 'conv_activation': 'sigmoid', 'conv_kernel_size': 7, 'conv_batchnorm': False, 'adaptive_pool_size': 4, 'lin_layers': 1, 'lin_activation': 'relu', 'lin_batchnorm': False, 'lr': 0.0001}. Best is trial 0 with value: 0.2918410822749138.
[I 2025-08-12 15:33:54,204] Trial 65 pruned. 
[I 2025-08-12 15:33:54,948] Trial 66 pruned. 
[I 2025-08-12 15:33:56,884] Trial 67 pruned. 
[I 2025-08-12 15:33:57,444] Trial 68 pruned. 
[I 2025-08-12 15:33:58,298] Trial 69 pruned. 
[I 2025-08-12 15:34:00,709] Trial 70 finished with value: 0.9607619941234589 and parameters: {'conv_layers': 2, 'conv_activation': 'sigmoid', 'conv_kernel_size': 7, 'conv_batchnorm': False, 'adaptive_pool_size': 4, 'lin_layers': 1, 'lin_activation': 'relu', 'lin_batchnorm': False, 'lr': 0.0001}. Best is trial 0 with value: 0.2918410822749138.
[I 2025-08-12 15:34:02,602] Trial 71 pruned. 
[I 2025-08-12 15:34:05,185] Trial 72 finished with value: 0.9622771143913269 and parameters: {'conv_layers': 2, 'conv_activation': 'sigmoid', 'conv_kernel_size': 7, 'conv_batchnorm': False, 'adaptive_pool_size': 4, 'lin_layers': 1, 'lin_activation': 'relu', 'lin_batchnorm': False, 'lr': 0.0001}. Best is trial 0 with value: 0.2918410822749138.
[I 2025-08-12 15:34:05,975] Trial 73 pruned. 
[I 2025-08-12 15:34:08,068] Trial 74 pruned. 
[I 2025-08-12 15:34:10,462] Trial 75 finished with value: 1.0720247626304626 and parameters: {'conv_layers': 3, 'conv_activation': 'relu', 'conv_kernel_size': 7, 'conv_batchnorm': False, 'adaptive_pool_size': 1, 'lin_layers': 1, 'lin_activation': 'relu', 'lin_batchnorm': False, 'lr': 0.005}. Best is trial 0 with value: 0.2918410822749138.
[I 2025-08-12 15:34:13,018] Trial 76 finished with value: 1.0285273790359497 and parameters: {'conv_layers': 2, 'conv_activation': 'sigmoid', 'conv_kernel_size': 7, 'conv_batchnorm': False, 'adaptive_pool_size': 2, 'lin_layers': 1, 'lin_activation': 'tanh', 'lin_batchnorm': False, 'lr': 0.0001}. Best is trial 0 with value: 0.2918410822749138.
[I 2025-08-12 15:34:13,913] Trial 77 pruned. 
[I 2025-08-12 15:34:14,788] Trial 78 pruned. 
[I 2025-08-12 15:34:15,366] Trial 79 pruned. 
[I 2025-08-12 15:34:16,269] Trial 80 pruned. 
[I 2025-08-12 15:34:18,979] Trial 81 finished with value: 0.9935564696788788 and parameters: {'conv_layers': 2, 'conv_activation': 'sigmoid', 'conv_kernel_size': 7, 'conv_batchnorm': False, 'adaptive_pool_size': 4, 'lin_layers': 1, 'lin_activation': 'relu', 'lin_batchnorm': False, 'lr': 0.0001}. Best is trial 0 with value: 0.2918410822749138.
[I 2025-08-12 15:34:19,800] Trial 82 pruned. 
[I 2025-08-12 15:34:22,909] Trial 83 finished with value: 1.0010004937648773 and parameters: {'conv_layers': 2, 'conv_activation': 'sigmoid', 'conv_kernel_size': 7, 'conv_batchnorm': False, 'adaptive_pool_size': 4, 'lin_layers': 1, 'lin_activation': 'relu', 'lin_batchnorm': False, 'lr': 0.0001}. Best is trial 0 with value: 0.2918410822749138.
[I 2025-08-12 15:34:25,489] Trial 84 finished with value: 1.011781096458435 and parameters: {'conv_layers': 2, 'conv_activation': 'sigmoid', 'conv_kernel_size': 7, 'conv_batchnorm': False, 'adaptive_pool_size': 4, 'lin_layers': 1, 'lin_activation': 'relu', 'lin_batchnorm': False, 'lr': 0.0001}. Best is trial 0 with value: 0.2918410822749138.
[I 2025-08-12 15:34:27,095] Trial 85 pruned. 
[I 2025-08-12 15:34:29,041] Trial 86 pruned. 
[I 2025-08-12 15:34:30,562] Trial 87 pruned. 
[I 2025-08-12 15:34:31,205] Trial 88 pruned. 
[I 2025-08-12 15:34:31,876] Trial 89 pruned. 
[I 2025-08-12 15:34:34,913] Trial 90 finished with value: 1.0397346019744873 and parameters: {'conv_layers': 2, 'conv_activation': 'sigmoid', 'conv_kernel_size': 7, 'conv_batchnorm': False, 'adaptive_pool_size': 4, 'lin_layers': 2, 'lin_activation': 'tanh', 'lin_batchnorm': False, 'lr': 0.05}. Best is trial 0 with value: 0.2918410822749138.
[I 2025-08-12 15:34:36,730] Trial 91 pruned. 
[I 2025-08-12 15:34:37,777] Trial 92 pruned. 
[I 2025-08-12 15:34:38,702] Trial 93 pruned. 
[I 2025-08-12 15:34:39,283] Trial 94 pruned. 
[I 2025-08-12 15:34:41,804] Trial 95 finished with value: 1.0787668824195862 and parameters: {'conv_layers': 4, 'conv_activation': 'sigmoid', 'conv_kernel_size': 5, 'conv_batchnorm': False, 'adaptive_pool_size': 4, 'lin_layers': 1, 'lin_activation': 'relu', 'lin_batchnorm': False, 'lr': 0.005}. Best is trial 0 with value: 0.2918410822749138.
[I 2025-08-12 15:34:42,806] Trial 96 pruned. 
[I 2025-08-12 15:34:43,404] Trial 97 pruned. 
[I 2025-08-12 15:34:43,934] Trial 98 pruned. 
[I 2025-08-12 15:34:44,738] Trial 99 pruned. 
[I 2025-08-12 15:34:47,437] Trial 100 finished with value: 1.0930201411247253 and parameters: {'conv_layers': 4, 'conv_activation': 'sigmoid', 'conv_kernel_size': 7, 'conv_batchnorm': False, 'adaptive_pool_size': 4, 'lin_layers': 3, 'lin_activation': 'sigmoid', 'lin_batchnorm': False, 'lr': 0.0001}. Best is trial 0 with value: 0.2918410822749138.
[I 2025-08-12 15:34:49,318] Trial 101 pruned. 
[I 2025-08-12 15:34:51,873] Trial 102 finished with value: 0.9848081469535828 and parameters: {'conv_layers': 2, 'conv_activation': 'sigmoid', 'conv_kernel_size': 7, 'conv_batchnorm': False, 'adaptive_pool_size': 4, 'lin_layers': 1, 'lin_activation': 'relu', 'lin_batchnorm': False, 'lr': 0.0001}. Best is trial 0 with value: 0.2918410822749138.
[I 2025-08-12 15:34:54,861] Trial 103 finished with value: 0.9206702709197998 and parameters: {'conv_layers': 2, 'conv_activation': 'sigmoid', 'conv_kernel_size': 7, 'conv_batchnorm': False, 'adaptive_pool_size': 4, 'lin_layers': 1, 'lin_activation': 'relu', 'lin_batchnorm': False, 'lr': 0.0001}. Best is trial 0 with value: 0.2918410822749138.
[I 2025-08-12 15:34:57,602] Trial 104 finished with value: 1.000291496515274 and parameters: {'conv_layers': 2, 'conv_activation': 'sigmoid', 'conv_kernel_size': 7, 'conv_batchnorm': False, 'adaptive_pool_size': 4, 'lin_layers': 1, 'lin_activation': 'relu', 'lin_batchnorm': False, 'lr': 0.0001}. Best is trial 0 with value: 0.2918410822749138.
[I 2025-08-12 15:35:00,485] Trial 105 finished with value: 0.9801087975502014 and parameters: {'conv_layers': 2, 'conv_activation': 'sigmoid', 'conv_kernel_size': 7, 'conv_batchnorm': False, 'adaptive_pool_size': 4, 'lin_layers': 2, 'lin_activation': 'relu', 'lin_batchnorm': False, 'lr': 0.005}. Best is trial 0 with value: 0.2918410822749138.
[I 2025-08-12 15:35:02,288] Trial 106 pruned. 
[I 2025-08-12 15:35:04,167] Trial 107 pruned. 
[I 2025-08-12 15:35:05,101] Trial 108 pruned. 
[I 2025-08-12 15:35:05,785] Trial 109 pruned. 
[I 2025-08-12 15:35:07,552] Trial 110 pruned. 
[I 2025-08-12 15:35:09,636] Trial 111 pruned. 
[I 2025-08-12 15:35:11,391] Trial 112 pruned. 
[I 2025-08-12 15:35:13,405] Trial 113 pruned. 
[I 2025-08-12 15:35:16,078] Trial 114 finished with value: 0.9373830556869507 and parameters: {'conv_layers': 2, 'conv_activation': 'sigmoid', 'conv_kernel_size': 7, 'conv_batchnorm': False, 'adaptive_pool_size': 4, 'lin_layers': 1, 'lin_activation': 'relu', 'lin_batchnorm': False, 'lr': 0.0001}. Best is trial 0 with value: 0.2918410822749138.
[I 2025-08-12 15:35:19,128] Trial 115 finished with value: 0.9883967638015747 and parameters: {'conv_layers': 2, 'conv_activation': 'sigmoid', 'conv_kernel_size': 7, 'conv_batchnorm': False, 'adaptive_pool_size': 4, 'lin_layers': 1, 'lin_activation': 'relu', 'lin_batchnorm': False, 'lr': 0.0001}. Best is trial 0 with value: 0.2918410822749138.
[I 2025-08-12 15:35:22,178] Trial 116 finished with value: 1.0795540809631348 and parameters: {'conv_layers': 5, 'conv_activation': 'sigmoid', 'conv_kernel_size': 7, 'conv_batchnorm': False, 'adaptive_pool_size': 4, 'lin_layers': 1, 'lin_activation': 'relu', 'lin_batchnorm': False, 'lr': 0.0001}. Best is trial 0 with value: 0.2918410822749138.
[I 2025-08-12 15:35:25,213] Trial 117 finished with value: 1.0827813148498535 and parameters: {'conv_layers': 2, 'conv_activation': 'sigmoid', 'conv_kernel_size': 7, 'conv_batchnorm': False, 'adaptive_pool_size': 4, 'lin_layers': 1, 'lin_activation': 'relu', 'lin_batchnorm': False, 'lr': 0.005}. Best is trial 0 with value: 0.2918410822749138.
[I 2025-08-12 15:35:27,867] Trial 118 finished with value: 1.0797759294509888 and parameters: {'conv_layers': 3, 'conv_activation': 'sigmoid', 'conv_kernel_size': 3, 'conv_batchnorm': False, 'adaptive_pool_size': 2, 'lin_layers': 1, 'lin_activation': 'relu', 'lin_batchnorm': False, 'lr': 0.0001}. Best is trial 0 with value: 0.2918410822749138.
[I 2025-08-12 15:35:28,681] Trial 119 pruned. 
[I 2025-08-12 15:35:29,886] Trial 120 pruned. 
[I 2025-08-12 15:35:32,754] Trial 121 finished with value: 0.9709063768386841 and parameters: {'conv_layers': 2, 'conv_activation': 'sigmoid', 'conv_kernel_size': 7, 'conv_batchnorm': False, 'adaptive_pool_size': 4, 'lin_layers': 1, 'lin_activation': 'relu', 'lin_batchnorm': False, 'lr': 0.0001}. Best is trial 0 with value: 0.2918410822749138.
[I 2025-08-12 15:35:34,850] Trial 122 pruned. 
[I 2025-08-12 15:35:37,626] Trial 123 finished with value: 0.9121275842189789 and parameters: {'conv_layers': 2, 'conv_activation': 'sigmoid', 'conv_kernel_size': 7, 'conv_batchnorm': False, 'adaptive_pool_size': 4, 'lin_layers': 1, 'lin_activation': 'relu', 'lin_batchnorm': False, 'lr': 0.0001}. Best is trial 0 with value: 0.2918410822749138.
[I 2025-08-12 15:35:40,661] Trial 124 finished with value: 1.0237013101577759 and parameters: {'conv_layers': 2, 'conv_activation': 'sigmoid', 'conv_kernel_size': 7, 'conv_batchnorm': False, 'adaptive_pool_size': 4, 'lin_layers': 1, 'lin_activation': 'relu', 'lin_batchnorm': False, 'lr': 0.0001}. Best is trial 0 with value: 0.2918410822749138.
[I 2025-08-12 15:35:42,405] Trial 125 pruned. 
[I 2025-08-12 15:35:43,214] Trial 126 pruned. 
[I 2025-08-12 15:35:46,161] Trial 127 finished with value: 1.0498646199703217 and parameters: {'conv_layers': 2, 'conv_activation': 'sigmoid', 'conv_kernel_size': 7, 'conv_batchnorm': True, 'adaptive_pool_size': 4, 'lin_layers': 1, 'lin_activation': 'relu', 'lin_batchnorm': False, 'lr': 0.05}. Best is trial 0 with value: 0.2918410822749138.
[I 2025-08-12 15:35:49,071] Trial 128 finished with value: 1.0377144813537598 and parameters: {'conv_layers': 2, 'conv_activation': 'sigmoid', 'conv_kernel_size': 7, 'conv_batchnorm': False, 'adaptive_pool_size': 3, 'lin_layers': 1, 'lin_activation': 'relu', 'lin_batchnorm': False, 'lr': 0.0001}. Best is trial 0 with value: 0.2918410822749138.
[I 2025-08-12 15:35:49,864] Trial 129 pruned. 
[I 2025-08-12 15:35:50,742] Trial 130 pruned. 
[I 2025-08-12 15:35:53,492] Trial 131 finished with value: 1.0663200318813324 and parameters: {'conv_layers': 2, 'conv_activation': 'sigmoid', 'conv_kernel_size': 7, 'conv_batchnorm': False, 'adaptive_pool_size': 4, 'lin_layers': 3, 'lin_activation': 'relu', 'lin_batchnorm': False, 'lr': 0.0001}. Best is trial 0 with value: 0.2918410822749138.
[I 2025-08-12 15:35:56,815] Trial 132 finished with value: 0.9208563268184662 and parameters: {'conv_layers': 2, 'conv_activation': 'sigmoid', 'conv_kernel_size': 7, 'conv_batchnorm': False, 'adaptive_pool_size': 4, 'lin_layers': 1, 'lin_activation': 'relu', 'lin_batchnorm': False, 'lr': 0.0001}. Best is trial 0 with value: 0.2918410822749138.
[I 2025-08-12 15:36:03,773] Trial 133 finished with value: 0.9489865899085999 and parameters: {'conv_layers': 2, 'conv_activation': 'sigmoid', 'conv_kernel_size': 7, 'conv_batchnorm': False, 'adaptive_pool_size': 4, 'lin_layers': 1, 'lin_activation': 'relu', 'lin_batchnorm': False, 'lr': 0.0001}. Best is trial 0 with value: 0.2918410822749138.
[I 2025-08-12 15:36:12,024] Trial 134 finished with value: 0.9991500079631805 and parameters: {'conv_layers': 2, 'conv_activation': 'sigmoid', 'conv_kernel_size': 7, 'conv_batchnorm': False, 'adaptive_pool_size': 4, 'lin_layers': 1, 'lin_activation': 'relu', 'lin_batchnorm': False, 'lr': 0.0001}. Best is trial 0 with value: 0.2918410822749138.
[I 2025-08-12 15:36:17,058] Trial 135 finished with value: 1.041505366563797 and parameters: {'conv_layers': 2, 'conv_activation': 'sigmoid', 'conv_kernel_size': 7, 'conv_batchnorm': False, 'adaptive_pool_size': 4, 'lin_layers': 1, 'lin_activation': 'relu', 'lin_batchnorm': False, 'lr': 0.0001}. Best is trial 0 with value: 0.2918410822749138.
