[I 2025-08-12 15:39:59,982] Trial 242 finished with value: 0.9410637617111206 and parameters: {'conv_layers': 2, 'conv_activation': 'sigmoid', 'conv_kernel_size': 7, 'conv_batchnorm': False, 'adaptive_pool_size': 4, 'lin_layers': 1, 'lin_activation': 'relu', 'lin_batchnorm': False, 'lr': 0.0001}. Best is trial 0 with value: 0.2918410822749138.
[I 2025-08-12 15:40:02,901] Trial 243 finished with value: 1.0032753348350525 and parameters: {'conv_layers': 2, 'conv_activation': 'sigmoid', 'conv_kernel_size': 7, 'conv_batchnorm': False, 'adaptive_pool_size': 4, 'lin_layers': 1, 'lin_activation': 'relu', 'lin_batchnorm': False, 'lr': 0.0001}. Best is trial 0 with value: 0.2918410822749138.
[I 2025-08-12 15:40:05,525] Trial 244 finished with value: 0.9294594824314117 and parameters: {'conv_layers': 2, 'conv_activation': 'sigmoid', 'conv_kernel_size': 7, 'conv_batchnorm': False, 'adaptive_pool_size': 4, 'lin_layers': 1, 'lin_activation': 'relu', 'lin_batchnorm': False, 'lr': 0.0001}. Best is trial 0 with value: 0.2918410822749138.
[I 2025-08-12 15:40:08,488] Trial 245 finished with value: 0.9684916138648987 and parameters: {'conv_layers': 2, 'conv_activation': 'sigmoid', 'conv_kernel_size': 7, 'conv_batchnorm': False, 'adaptive_pool_size': 4, 'lin_layers': 1, 'lin_activation': 'relu', 'lin_batchnorm': False, 'lr': 0.0001}. Best is trial 0 with value: 0.2918410822749138.
[I 2025-08-12 15:40:11,171] Trial 246 finished with value: 0.9502379298210144 and parameters: {'conv_layers': 2, 'conv_activation': 'sigmoid', 'conv_kernel_size': 7, 'conv_batchnorm': False, 'adaptive_pool_size': 4, 'lin_layers': 1, 'lin_activation': 'relu', 'lin_batchnorm': False, 'lr': 0.0001}. Best is trial 0 with value: 0.2918410822749138.
[I 2025-08-12 15:40:13,157] Trial 247 pruned. 
[I 2025-08-12 15:40:13,836] Trial 248 pruned. 
[I 2025-08-12 15:40:16,601] Trial 249 finished with value: 1.0473337173461914 and parameters: {'conv_layers': 2, 'conv_activation': 'sigmoid', 'conv_kernel_size': 5, 'conv_batchnorm': False, 'adaptive_pool_size': 4, 'lin_layers': 1, 'lin_activation': 'relu', 'lin_batchnorm': False, 'lr': 0.0001}. Best is trial 0 with value: 0.2918410822749138.
[I 2025-08-12 15:40:19,292] Trial 250 finished with value: 0.8332044780254364 and parameters: {'conv_layers': 2, 'conv_activation': 'sigmoid', 'conv_kernel_size': 7, 'conv_batchnorm': False, 'adaptive_pool_size': 4, 'lin_layers': 1, 'lin_activation': 'relu', 'lin_batchnorm': False, 'lr': 0.001}. Best is trial 0 with value: 0.2918410822749138.
[I 2025-08-12 15:40:20,007] Trial 251 pruned. 
[I 2025-08-12 15:40:22,249] Trial 252 pruned. 
[I 2025-08-12 15:40:24,888] Trial 253 finished with value: 1.002810686826706 and parameters: {'conv_layers': 3, 'conv_activation': 'sigmoid', 'conv_kernel_size': 7, 'conv_batchnorm': False, 'adaptive_pool_size': 4, 'lin_layers': 1, 'lin_activation': 'relu', 'lin_batchnorm': False, 'lr': 0.001}. Best is trial 0 with value: 0.2918410822749138.
[I 2025-08-12 15:40:25,659] Trial 254 pruned. 
[I 2025-08-12 15:40:28,441] Trial 255 finished with value: 0.6575901210308075 and parameters: {'conv_layers': 2, 'conv_activation': 'sigmoid', 'conv_kernel_size': 3, 'conv_batchnorm': False, 'adaptive_pool_size': 4, 'lin_layers': 1, 'lin_activation': 'relu', 'lin_batchnorm': False, 'lr': 0.001}. Best is trial 0 with value: 0.2918410822749138.
[I 2025-08-12 15:40:31,034] Trial 256 finished with value: 1.0567213296890259 and parameters: {'conv_layers': 2, 'conv_activation': 'sigmoid', 'conv_kernel_size': 3, 'conv_batchnorm': False, 'adaptive_pool_size': 4, 'lin_layers': 1, 'lin_activation': 'relu', 'lin_batchnorm': False, 'lr': 0.001}. Best is trial 0 with value: 0.2918410822749138.
[I 2025-08-12 15:40:33,598] Trial 257 finished with value: 1.0594516396522522 and parameters: {'conv_layers': 2, 'conv_activation': 'sigmoid', 'conv_kernel_size': 3, 'conv_batchnorm': False, 'adaptive_pool_size': 4, 'lin_layers': 1, 'lin_activation': 'relu', 'lin_batchnorm': False, 'lr': 0.001}. Best is trial 0 with value: 0.2918410822749138.
[I 2025-08-12 15:40:35,446] Trial 258 pruned. 
[I 2025-08-12 15:40:37,363] Trial 259 pruned. 
[I 2025-08-12 15:40:40,066] Trial 260 finished with value: 1.0308625996112823 and parameters: {'conv_layers': 2, 'conv_activation': 'sigmoid', 'conv_kernel_size': 3, 'conv_batchnorm': False, 'adaptive_pool_size': 4, 'lin_layers': 1, 'lin_activation': 'relu', 'lin_batchnorm': False, 'lr': 0.001}. Best is trial 0 with value: 0.2918410822749138.
[I 2025-08-12 15:40:42,069] Trial 261 pruned. 
[I 2025-08-12 15:40:44,655] Trial 262 finished with value: 1.042228639125824 and parameters: {'conv_layers': 2, 'conv_activation': 'sigmoid', 'conv_kernel_size': 7, 'conv_batchnorm': False, 'adaptive_pool_size': 4, 'lin_layers': 1, 'lin_activation': 'relu', 'lin_batchnorm': False, 'lr': 0.05}. Best is trial 0 with value: 0.2918410822749138.
[I 2025-08-12 15:40:46,601] Trial 263 pruned. 
[I 2025-08-12 15:40:49,530] Trial 264 finished with value: 1.062349408864975 and parameters: {'conv_layers': 2, 'conv_activation': 'sigmoid', 'conv_kernel_size': 3, 'conv_batchnorm': False, 'adaptive_pool_size': 4, 'lin_layers': 1, 'lin_activation': 'sigmoid', 'lin_batchnorm': False, 'lr': 0.0001}. Best is trial 0 with value: 0.2918410822749138.
[I 2025-08-12 15:40:51,488] Trial 265 pruned. 
[I 2025-08-12 15:40:53,545] Trial 266 pruned. 
[I 2025-08-12 15:40:54,594] Trial 267 pruned. 
[I 2025-08-12 15:40:57,829] Trial 268 finished with value: 0.9693743884563446 and parameters: {'conv_layers': 2, 'conv_activation': 'sigmoid', 'conv_kernel_size': 7, 'conv_batchnorm': False, 'adaptive_pool_size': 4, 'lin_layers': 1, 'lin_activation': 'relu', 'lin_batchnorm': False, 'lr': 0.0001}. Best is trial 0 with value: 0.2918410822749138.
[I 2025-08-12 15:40:59,534] Trial 269 pruned. 
[I 2025-08-12 15:41:01,512] Trial 270 pruned. 
[I 2025-08-12 15:41:03,393] Trial 271 pruned. 
[I 2025-08-12 15:41:06,101] Trial 272 finished with value: 0.8568840324878693 and parameters: {'conv_layers': 2, 'conv_activation': 'sigmoid', 'conv_kernel_size': 7, 'conv_batchnorm': False, 'adaptive_pool_size': 4, 'lin_layers': 1, 'lin_activation': 'relu', 'lin_batchnorm': False, 'lr': 0.0001}. Best is trial 0 with value: 0.2918410822749138.
[I 2025-08-12 15:41:08,131] Trial 273 pruned. 
[I 2025-08-12 15:41:11,025] Trial 274 finished with value: 1.0816436409950256 and parameters: {'conv_layers': 3, 'conv_activation': 'sigmoid', 'conv_kernel_size': 7, 'conv_batchnorm': False, 'adaptive_pool_size': 4, 'lin_layers': 1, 'lin_activation': 'relu', 'lin_batchnorm': False, 'lr': 0.0001}. Best is trial 0 with value: 0.2918410822749138.
[I 2025-08-12 15:41:14,140] Trial 275 finished with value: 0.21435055881738663 and parameters: {'conv_layers': 2, 'conv_activation': 'sigmoid', 'conv_kernel_size': 7, 'conv_batchnorm': False, 'adaptive_pool_size': 3, 'lin_layers': 1, 'lin_activation': 'relu', 'lin_batchnorm': False, 'lr': 0.001}. Best is trial 275 with value: 0.21435055881738663.
[I 2025-08-12 15:41:14,981] Trial 276 pruned. 
[I 2025-08-12 15:41:15,447] Trial 277 pruned. 
[I 2025-08-12 15:41:15,991] Trial 278 pruned. 
[I 2025-08-12 15:41:17,995] Trial 279 pruned. 
[I 2025-08-12 15:41:18,675] Trial 280 pruned. 
[I 2025-08-12 15:41:21,171] Trial 281 finished with value: 1.017435371875763 and parameters: {'conv_layers': 2, 'conv_activation': 'sigmoid', 'conv_kernel_size': 7, 'conv_batchnorm': False, 'adaptive_pool_size': 4, 'lin_layers': 1, 'lin_activation': 'relu', 'lin_batchnorm': False, 'lr': 0.0001}. Best is trial 275 with value: 0.21435055881738663.
[I 2025-08-12 15:41:22,920] Trial 282 pruned. 
[I 2025-08-12 15:41:25,741] Trial 283 finished with value: 1.04813352227211 and parameters: {'conv_layers': 2, 'conv_activation': 'sigmoid', 'conv_kernel_size': 7, 'conv_batchnorm': False, 'adaptive_pool_size': 3, 'lin_layers': 1, 'lin_activation': 'sigmoid', 'lin_batchnorm': False, 'lr': 0.05}. Best is trial 275 with value: 0.21435055881738663.
[I 2025-08-12 15:41:27,922] Trial 284 pruned. 
[I 2025-08-12 15:41:30,194] Trial 285 pruned. 
[I 2025-08-12 15:41:33,099] Trial 286 finished with value: 0.9019988775253296 and parameters: {'conv_layers': 2, 'conv_activation': 'sigmoid', 'conv_kernel_size': 7, 'conv_batchnorm': False, 'adaptive_pool_size': 4, 'lin_layers': 1, 'lin_activation': 'tanh', 'lin_batchnorm': False, 'lr': 0.0001}. Best is trial 275 with value: 0.21435055881738663.
[I 2025-08-12 15:41:35,322] Trial 287 pruned. 
[I 2025-08-12 15:41:37,186] Trial 288 pruned. 
[I 2025-08-12 15:41:40,402] Trial 289 finished with value: 0.9738549292087555 and parameters: {'conv_layers': 2, 'conv_activation': 'sigmoid', 'conv_kernel_size': 7, 'conv_batchnorm': False, 'adaptive_pool_size': 4, 'lin_layers': 1, 'lin_activation': 'relu', 'lin_batchnorm': False, 'lr': 0.0001}. Best is trial 275 with value: 0.21435055881738663.
[I 2025-08-12 15:41:43,742] Trial 290 finished with value: 0.9163314700126648 and parameters: {'conv_layers': 2, 'conv_activation': 'sigmoid', 'conv_kernel_size': 7, 'conv_batchnorm': False, 'adaptive_pool_size': 4, 'lin_layers': 1, 'lin_activation': 'tanh', 'lin_batchnorm': False, 'lr': 0.0001}. Best is trial 275 with value: 0.21435055881738663.
[I 2025-08-12 15:41:45,836] Trial 291 pruned. 
[I 2025-08-12 15:41:46,544] Trial 292 pruned. 
[I 2025-08-12 15:41:49,731] Trial 293 finished with value: 0.935142993927002 and parameters: {'conv_layers': 2, 'conv_activation': 'sigmoid', 'conv_kernel_size': 7, 'conv_batchnorm': False, 'adaptive_pool_size': 4, 'lin_layers': 1, 'lin_activation': 'tanh', 'lin_batchnorm': False, 'lr': 0.0001}. Best is trial 275 with value: 0.21435055881738663.
[I 2025-08-12 15:41:50,412] Trial 294 pruned. 
[I 2025-08-12 15:41:52,058] Trial 295 pruned. 
[I 2025-08-12 15:41:54,984] Trial 296 finished with value: 0.9002239406108856 and parameters: {'conv_layers': 2, 'conv_activation': 'sigmoid', 'conv_kernel_size': 7, 'conv_batchnorm': False, 'adaptive_pool_size': 4, 'lin_layers': 1, 'lin_activation': 'tanh', 'lin_batchnorm': False, 'lr': 0.001}. Best is trial 275 with value: 0.21435055881738663.
[I 2025-08-12 15:41:57,724] Trial 297 finished with value: 1.0496919453144073 and parameters: {'conv_layers': 2, 'conv_activation': 'sigmoid', 'conv_kernel_size': 5, 'conv_batchnorm': False, 'adaptive_pool_size': 4, 'lin_layers': 1, 'lin_activation': 'tanh', 'lin_batchnorm': False, 'lr': 0.001}. Best is trial 275 with value: 0.21435055881738663.
[I 2025-08-12 15:41:58,927] Trial 298 pruned. 
[I 2025-08-12 15:42:01,897] Trial 299 finished with value: 1.0827852487564087 and parameters: {'conv_layers': 3, 'conv_activation': 'sigmoid', 'conv_kernel_size': 7, 'conv_batchnorm': False, 'adaptive_pool_size': 4, 'lin_layers': 1, 'lin_activation': 'tanh', 'lin_batchnorm': False, 'lr': 0.001}. Best is trial 275 with value: 0.21435055881738663.
[I 2025-08-12 15:42:02,490] Trial 300 pruned. 
[I 2025-08-12 15:42:03,135] Trial 301 pruned. 
[I 2025-08-12 15:42:03,694] Trial 302 pruned. 
[I 2025-08-12 15:42:05,663] Trial 303 pruned. 
[I 2025-08-12 15:42:08,547] Trial 304 finished with value: 1.090637356042862 and parameters: {'conv_layers': 2, 'conv_activation': 'sigmoid', 'conv_kernel_size': 7, 'conv_batchnorm': False, 'adaptive_pool_size': 4, 'lin_layers': 2, 'lin_activation': 'tanh', 'lin_batchnorm': False, 'lr': 0.05}. Best is trial 275 with value: 0.21435055881738663.
[I 2025-08-12 15:42:09,679] Trial 305 pruned. 
[I 2025-08-12 15:42:10,270] Trial 306 pruned. 
[I 2025-08-12 15:42:12,426] Trial 307 finished with value: 1.0750357508659363 and parameters: {'conv_layers': 2, 'conv_activation': 'sigmoid', 'conv_kernel_size': 3, 'conv_batchnorm': False, 'adaptive_pool_size': 4, 'lin_layers': 1, 'lin_activation': 'sigmoid', 'lin_batchnorm': False, 'lr': 0.0001}. Best is trial 275 with value: 0.21435055881738663.
[I 2025-08-12 15:42:14,238] Trial 308 pruned. 
[I 2025-08-12 15:42:17,280] Trial 309 finished with value: 0.6398985832929611 and parameters: {'conv_layers': 3, 'conv_activation': 'sigmoid', 'conv_kernel_size': 7, 'conv_batchnorm': False, 'adaptive_pool_size': 4, 'lin_layers': 1, 'lin_activation': 'relu', 'lin_batchnorm': False, 'lr': 0.001}. Best is trial 275 with value: 0.21435055881738663.
[I 2025-08-12 15:42:20,249] Trial 310 finished with value: 1.0389262437820435 and parameters: {'conv_layers': 3, 'conv_activation': 'sigmoid', 'conv_kernel_size': 7, 'conv_batchnorm': False, 'adaptive_pool_size': 4, 'lin_layers': 1, 'lin_activation': 'relu', 'lin_batchnorm': False, 'lr': 0.001}. Best is trial 275 with value: 0.21435055881738663.
[I 2025-08-12 15:42:22,718] Trial 311 finished with value: 1.0838623046875 and parameters: {'conv_layers': 3, 'conv_activation': 'sigmoid', 'conv_kernel_size': 7, 'conv_batchnorm': False, 'adaptive_pool_size': 4, 'lin_layers': 1, 'lin_activation': 'tanh', 'lin_batchnorm': False, 'lr': 0.001}. Best is trial 275 with value: 0.21435055881738663.
[I 2025-08-12 15:42:23,200] Trial 312 pruned. 
[I 2025-08-12 15:42:26,345] Trial 313 finished with value: 0.9004892706871033 and parameters: {'conv_layers': 3, 'conv_activation': 'sigmoid', 'conv_kernel_size': 7, 'conv_batchnorm': False, 'adaptive_pool_size': 2, 'lin_layers': 1, 'lin_activation': 'relu', 'lin_batchnorm': False, 'lr': 0.001}. Best is trial 275 with value: 0.21435055881738663.
[I 2025-08-12 15:42:28,756] Trial 314 finished with value: 0.9049771428108215 and parameters: {'conv_layers': 3, 'conv_activation': 'sigmoid', 'conv_kernel_size': 7, 'conv_batchnorm': False, 'adaptive_pool_size': 2, 'lin_layers': 1, 'lin_activation': 'relu', 'lin_batchnorm': False, 'lr': 0.001}. Best is trial 275 with value: 0.21435055881738663.
[I 2025-08-12 15:42:31,508] Trial 315 finished with value: 1.0683441460132599 and parameters: {'conv_layers': 3, 'conv_activation': 'sigmoid', 'conv_kernel_size': 7, 'conv_batchnorm': False, 'adaptive_pool_size': 2, 'lin_layers': 1, 'lin_activation': 'relu', 'lin_batchnorm': False, 'lr': 0.001}. Best is trial 275 with value: 0.21435055881738663.
[I 2025-08-12 15:42:34,506] Trial 316 finished with value: 0.7336614727973938 and parameters: {'conv_layers': 3, 'conv_activation': 'sigmoid', 'conv_kernel_size': 7, 'conv_batchnorm': False, 'adaptive_pool_size': 2, 'lin_layers': 1, 'lin_activation': 'relu', 'lin_batchnorm': False, 'lr': 0.001}. Best is trial 275 with value: 0.21435055881738663.
[I 2025-08-12 15:42:37,398] Trial 317 finished with value: 1.0775810480117798 and parameters: {'conv_layers': 3, 'conv_activation': 'sigmoid', 'conv_kernel_size': 7, 'conv_batchnorm': False, 'adaptive_pool_size': 2, 'lin_layers': 1, 'lin_activation': 'tanh', 'lin_batchnorm': False, 'lr': 0.001}. Best is trial 275 with value: 0.21435055881738663.
[I 2025-08-12 15:42:37,892] Trial 318 pruned. 
[I 2025-08-12 15:42:40,458] Trial 319 finished with value: 0.5801371335983276 and parameters: {'conv_layers': 3, 'conv_activation': 'sigmoid', 'conv_kernel_size': 5, 'conv_batchnorm': False, 'adaptive_pool_size': 3, 'lin_layers': 1, 'lin_activation': 'relu', 'lin_batchnorm': False, 'lr': 0.001}. Best is trial 275 with value: 0.21435055881738663.
[I 2025-08-12 15:42:42,028] Trial 320 pruned. 
[I 2025-08-12 15:42:44,497] Trial 321 finished with value: 0.7470628023147583 and parameters: {'conv_layers': 3, 'conv_activation': 'sigmoid', 'conv_kernel_size': 5, 'conv_batchnorm': False, 'adaptive_pool_size': 2, 'lin_layers': 1, 'lin_activation': 'relu', 'lin_batchnorm': False, 'lr': 0.001}. Best is trial 275 with value: 0.21435055881738663.
[I 2025-08-12 15:42:47,399] Trial 322 finished with value: 1.0681942105293274 and parameters: {'conv_layers': 3, 'conv_activation': 'sigmoid', 'conv_kernel_size': 5, 'conv_batchnorm': False, 'adaptive_pool_size': 2, 'lin_layers': 1, 'lin_activation': 'relu', 'lin_batchnorm': False, 'lr': 0.001}. Best is trial 275 with value: 0.21435055881738663.
[I 2025-08-12 15:42:48,172] Trial 323 pruned. 
[I 2025-08-12 15:42:51,155] Trial 324 finished with value: 1.048816740512848 and parameters: {'conv_layers': 3, 'conv_activation': 'sigmoid', 'conv_kernel_size': 5, 'conv_batchnorm': False, 'adaptive_pool_size': 2, 'lin_layers': 1, 'lin_activation': 'tanh', 'lin_batchnorm': False, 'lr': 0.001}. Best is trial 275 with value: 0.21435055881738663.
[I 2025-08-12 15:42:54,043] Trial 325 finished with value: 0.7258066833019257 and parameters: {'conv_layers': 3, 'conv_activation': 'sigmoid', 'conv_kernel_size': 5, 'conv_batchnorm': False, 'adaptive_pool_size': 2, 'lin_layers': 3, 'lin_activation': 'relu', 'lin_batchnorm': False, 'lr': 0.001}. Best is trial 275 with value: 0.21435055881738663.
[I 2025-08-12 15:42:54,786] Trial 326 pruned. 
[I 2025-08-12 15:42:57,740] Trial 327 finished with value: 0.8846703171730042 and parameters: {'conv_layers': 3, 'conv_activation': 'sigmoid', 'conv_kernel_size': 5, 'conv_batchnorm': False, 'adaptive_pool_size': 2, 'lin_layers': 3, 'lin_activation': 'relu', 'lin_batchnorm': False, 'lr': 0.001}. Best is trial 275 with value: 0.21435055881738663.
[I 2025-08-12 15:43:00,443] Trial 328 finished with value: 1.0921579599380493 and parameters: {'conv_layers': 3, 'conv_activation': 'sigmoid', 'conv_kernel_size': 5, 'conv_batchnorm': False, 'adaptive_pool_size': 2, 'lin_layers': 3, 'lin_activation': 'relu', 'lin_batchnorm': False, 'lr': 0.001}. Best is trial 275 with value: 0.21435055881738663.
[I 2025-08-12 15:43:02,412] Trial 329 pruned. 
[I 2025-08-12 15:43:04,665] Trial 330 finished with value: 0.7591931223869324 and parameters: {'conv_layers': 3, 'conv_activation': 'sigmoid', 'conv_kernel_size': 5, 'conv_batchnorm': False, 'adaptive_pool_size': 2, 'lin_layers': 3, 'lin_activation': 'relu', 'lin_batchnorm': False, 'lr': 0.001}. Best is trial 275 with value: 0.21435055881738663.
[I 2025-08-12 15:43:07,536] Trial 331 finished with value: 0.5017457455396652 and parameters: {'conv_layers': 3, 'conv_activation': 'sigmoid', 'conv_kernel_size': 5, 'conv_batchnorm': False, 'adaptive_pool_size': 2, 'lin_layers': 3, 'lin_activation': 'relu', 'lin_batchnorm': False, 'lr': 0.001}. Best is trial 275 with value: 0.21435055881738663.
[I 2025-08-12 15:43:09,926] Trial 332 finished with value: 0.6705463230609894 and parameters: {'conv_layers': 3, 'conv_activation': 'sigmoid', 'conv_kernel_size': 5, 'conv_batchnorm': False, 'adaptive_pool_size': 2, 'lin_layers': 3, 'lin_activation': 'relu', 'lin_batchnorm': False, 'lr': 0.001}. Best is trial 275 with value: 0.21435055881738663.
[I 2025-08-12 15:43:12,039] Trial 333 pruned. 
[I 2025-08-12 15:43:13,875] Trial 334 finished with value: 0.7049730122089386 and parameters: {'conv_layers': 3, 'conv_activation': 'sigmoid', 'conv_kernel_size': 5, 'conv_batchnorm': False, 'adaptive_pool_size': 2, 'lin_layers': 3, 'lin_activation': 'relu', 'lin_batchnorm': False, 'lr': 0.001}. Best is trial 275 with value: 0.21435055881738663.
[I 2025-08-12 15:43:16,547] Trial 335 finished with value: 1.0811495184898376 and parameters: {'conv_layers': 3, 'conv_activation': 'sigmoid', 'conv_kernel_size': 5, 'conv_batchnorm': False, 'adaptive_pool_size': 2, 'lin_layers': 3, 'lin_activation': 'relu', 'lin_batchnorm': False, 'lr': 0.001}. Best is trial 275 with value: 0.21435055881738663.
[I 2025-08-12 15:43:18,670] Trial 336 finished with value: 0.8011465668678284 and parameters: {'conv_layers': 3, 'conv_activation': 'sigmoid', 'conv_kernel_size': 5, 'conv_batchnorm': False, 'adaptive_pool_size': 2, 'lin_layers': 3, 'lin_activation': 'relu', 'lin_batchnorm': False, 'lr': 0.001}. Best is trial 275 with value: 0.21435055881738663.
[I 2025-08-12 15:43:20,190] Trial 337 pruned. 
[I 2025-08-12 15:43:22,179] Trial 338 pruned. 
[I 2025-08-12 15:43:22,807] Trial 339 pruned. 
[I 2025-08-12 15:43:23,388] Trial 340 pruned. 
[I 2025-08-12 15:43:24,851] Trial 341 pruned. 
[I 2025-08-12 15:43:26,876] Trial 342 pruned. 
[I 2025-08-12 15:43:29,394] Trial 343 finished with value: 1.0717932283878326 and parameters: {'conv_layers': 3, 'conv_activation': 'sigmoid', 'conv_kernel_size': 5, 'conv_batchnorm': False, 'adaptive_pool_size': 2, 'lin_layers': 3, 'lin_activation': 'relu', 'lin_batchnorm': False, 'lr': 0.001}. Best is trial 275 with value: 0.21435055881738663.
[I 2025-08-12 15:43:31,498] Trial 344 pruned. 
[I 2025-08-12 15:43:34,295] Trial 345 finished with value: 1.0432771146297455 and parameters: {'conv_layers': 3, 'conv_activation': 'sigmoid', 'conv_kernel_size': 5, 'conv_batchnorm': False, 'adaptive_pool_size': 2, 'lin_layers': 3, 'lin_activation': 'relu', 'lin_batchnorm': False, 'lr': 0.001}. Best is trial 275 with value: 0.21435055881738663.
[I 2025-08-12 15:43:34,963] Trial 346 pruned. 
[I 2025-08-12 15:43:37,872] Trial 347 finished with value: 0.8119640648365021 and parameters: {'conv_layers': 3, 'conv_activation': 'sigmoid', 'conv_kernel_size': 5, 'conv_batchnorm': True, 'adaptive_pool_size': 2, 'lin_layers': 3, 'lin_activation': 'relu', 'lin_batchnorm': False, 'lr': 0.001}. Best is trial 275 with value: 0.21435055881738663.
[I 2025-08-12 15:43:38,582] Trial 348 pruned. 
[I 2025-08-12 15:43:39,782] Trial 349 pruned. 
[I 2025-08-12 15:43:40,807] Trial 350 pruned. 
[I 2025-08-12 15:43:41,924] Trial 351 pruned. 
[I 2025-08-12 15:43:43,666] Trial 352 pruned. 
[I 2025-08-12 15:43:44,016] Trial 353 pruned. 
[I 2025-08-12 15:43:45,211] Trial 354 pruned. 
[I 2025-08-12 15:43:48,279] Trial 355 finished with value: 0.6700751483440399 and parameters: {'conv_layers': 3, 'conv_activation': 'sigmoid', 'conv_kernel_size': 5, 'conv_batchnorm': False, 'adaptive_pool_size': 2, 'lin_layers': 3, 'lin_activation': 'relu', 'lin_batchnorm': False, 'lr': 0.001}. Best is trial 275 with value: 0.21435055881738663.
[I 2025-08-12 15:43:50,882] Trial 356 finished with value: 0.6430674344301224 and parameters: {'conv_layers': 3, 'conv_activation': 'sigmoid', 'conv_kernel_size': 5, 'conv_batchnorm': False, 'adaptive_pool_size': 2, 'lin_layers': 3, 'lin_activation': 'relu', 'lin_batchnorm': False, 'lr': 0.001}. Best is trial 275 with value: 0.21435055881738663.
